"LABID","Duplicates","Flags","FIELDID","Animal_ID","Stage_Class","Cruise","Platform","Shipper","Shipper_Organization","Shipped_Date","Received_Date","Collection_Method","Contact_ID","CONTACT_NAME","Organization_ID","Organization","Collector","Collector_Organization","Acknowledgement","Label","LAB","Species_ID","SpCode","SpType","Species_Type","SpName","Genus","Species","CommonName","SubSpecies","Species_Determ_List","USE","Restrict_Description","Date_Collected","YR","MO","DA","Location","City","Island","County","State","Country","Latitude","Latitude_Precision","Latitude_Precision_Unit","Longitude","Longitude_Precision","Longitude_Precision_Unit","OBasin","Ocean_Basin","SEX","Gender_Determination","ACCESSIONDATE","Repository_Numbers","COMMENTS","Record_Creation_Date","Edit_User","Edit_Date"
62,,,"KZP0016",181558,,,,,,,,"STRANDING",398,"STRANDING COORDINATOR ",1,"SWFSC",,,"NMFS, Southwest Fisheries Science Center",,"K_D",21,"021","C","CETACEA","G gri","Grampus","griseus","Risso's dolphin",,,"N",,"04/16/1990",1990,4,16,"TORREY PINES STATE BEACH",,,"San Diego","CALIFORNIA","UNITED STATES OF AMERICA",32.916666,1,"Minute",-117.25,1,"Minute",1,"North Pacific","F","Field determination: gonads were examined; carcass was examined and dissected.",,,,5/31/2012 15:57:58,"dan.prosperi",6/8/2022 7:21:53
72,,,"JEH1061",181568,,,,,,,,"STRANDING",561,"JORGE VELEZ-JUARBE",13,"Natural History Museum of Los Angeles County",,,"The Natural History Museum of Los Angeles County",,"ARC",21,"021","C","CETACEA","G gri","Grampus","griseus","Risso's dolphin",,,"Y","Donator requested that PI request permission to use in study","10/13/1981",1981,10,13,"LEO CARILLO BEACH",,,,"CALIFORNIA","UNITED STATES OF AMERICA",34.033333,1,"Minute",-118.916666,1,"Minute",1,"North Pacific","M","Field determination: gonads were examined; carcass was examined and dissected.",,,"O=LIVER",5/31/2012 15:57:59,"dan.prosperi",1/17/2023 14:27:13
141,,"CAGN","EKL0009",181637,,,,,,,,"BYCATCH",385,"Kerri Danil",459,"NMFS, SWR, OBSERVER PROGRAM",,,"NMFS, SOUTHWEST REGION FISHERY OBSERVER PROGRAM and SOUTHWEST FISHERIES SCIENCE CENTER",,"SJC",21,"021","C","CETACEA","G gri","Grampus","griseus","Risso's dolphin",,,"N",,"08/27/1991",1991,8,27,"OFFSHORE",,,,"CALIFORNIA","UNITED STATES OF AMERICA",35.183333,1,"Minute",-121.166666,1,"Minute",1,"North Pacific","F","Field determination: external exam only; live animal or carcass was examined but not dissected.",,,,5/31/2012 15:57:59,"dan.prosperi",6/17/2022 15:50:07
144,,"CAGN","CMS0003",181640,,,,,,,,"BYCATCH",385,"Kerri Danil",459,"NMFS, SWR, OBSERVER PROGRAM",,,"NMFS, SOUTHWEST REGION FISHERY OBSERVER PROGRAM and SOUTHWEST FISHERIES SCIENCE CENTER",,"SJC",21,"021","C","CETACEA","G gri","Grampus","griseus","Risso's dolphin",,,"N",,"07/20/1991",1991,7,20,"OFFSHORE",,,,"CALIFORNIA","UNITED STATES OF AMERICA",34.7,1,"Minute",-121.283333,1,"Minute",1,"North Pacific","F","Molecular determination: SRY method",,,,5/31/2012 15:57:59,"dan.prosperi",6/17/2022 15:50:07
451,,,"USNM347613",181919,,,,,,,,"STRANDING",470,"Darrin Lunde",256,"DIVISION OF MAMMALS, SMITHSONIAN INSTITUTION",,,"National Museum of Natural History, Smithsonian Institute",,"KMR",21,"021","C","CETACEA","G gri","Grampus","griseus","Risso's dolphin",,,"Y","Donator requested that PI request permission to use in study","12/30/1970",1970,12,30,"CAPE HATTERAS",,,,"NORTH CAROLINA","UNITED STATES OF AMERICA",34.333333,1,"Minute",-75.583333,1,"Minute",2,"North Atlantic","M","Field determination: external exam only; live animal or carcass was examined but not dissected.",,,"Include USNM accession number in Ack; Charlie Potter original contributor.  Source was recorded as ""STRAND-NC-USNM""",5/31/2012 15:58:04,"dan.prosperi",6/22/2022 14:15:26
479,,,"CWP0115/USNM550104",181947,,,,,,,,"STRANDING",470,"Darrin Lunde",256,"DIVISION OF MAMMALS, SMITHSONIAN INSTITUTION",,,"National Museum of Natural History, Smithsonian Institute",,"KMR",21,"021","C","CETACEA","G gri","Grampus","griseus","Risso's dolphin",,,"Y","Donator requested that PI request permission to use in study","05/13/1981",1981,5,13,,,,,"NORTH CAROLINA","UNITED STATES OF AMERICA",35.466666,1,"Minute",-75.466666,1,"Minute",2,"North Atlantic","F","Field determination: gonads were examined; carcass was examined and dissected.",,,"Include USNM accession number in Ack; Charlie Potter original contributor.  Source was recorded as ""STRAND-NC-USNM""",5/31/2012 15:58:04,"dan.prosperi",6/22/2022 14:15:26
483,,,"WAM0002/USNM550383",181951,,,,,,,,"STRANDING",470,"Darrin Lunde",256,"DIVISION OF MAMMALS, SMITHSONIAN INSTITUTION",,,"National Museum of Natural History, Smithsonian Institute",,"KMR",21,"021","C","CETACEA","G gri","Grampus","griseus","Risso's dolphin",,,"Y","Donator requested that PI request permission to use in study","09/08/1984",1984,9,8,,,,,"NORTH CAROLINA","UNITED STATES OF AMERICA",35.716666,1,"Minute",-75.483333,1,"Minute",2,"North Atlantic","M","Field determination: gonads were examined; carcass was examined and dissected.",,,"Include USNM accession number in Ack; Charlie Potter original contributor.  Source was recorded as ""STRAND-NC-USNM""",5/31/2012 15:58:04,"dan.prosperi",6/22/2022 14:15:26
533,,,"STR02564",182000,,,,,,,,"CAPTIVE",470,"Darrin Lunde",256,"DIVISION OF MAMMALS, SMITHSONIAN INSTITUTION",,,"National Museum of Natural History, Smithsonian Institute",,"KMR",21,"021","C","CETACEA","G gri","Grampus","griseus","Risso's dolphin",,,"Y","Donator requested that PI request permission to use in study","09/22/1971",1971,9,22,"NEWFOUNDLAND, TRINITY BAY",,,,,"CANADA",48.083333,1,"Minute",-53.083333,1,"Minute",2,"North Atlantic","M","Field determination: gonads were examined; carcass was examined and dissected.",,,"Include USNM accession number.  Source was recorded as ""CAPTIVE-USNM""",5/31/2012 15:58:05,"dan.prosperi",6/22/2022 14:15:26
542,,,"D-160-71",182008,,,,,,,,"UNKNOWN",470,"Darrin Lunde",256,"DIVISION OF MAMMALS, SMITHSONIAN INSTITUTION",,,"National Museum of Natural History, Smithsonian Institute",,"KMR",21,"021","C","CETACEA","G gri","Grampus","griseus","Risso's dolphin",,,"Y","Donator requested that PI request permission to use in study","??/??/????",,,,,,,,,,,,,,,,9,"Unknown","U",,,,"Include USNM accession number in Ack; Charlie Potter original contributor.  Source was recorded as ""UNKNOWN-USNM""",5/31/2012 15:58:05,"dan.prosperi",6/22/2022 14:15:26
776,,"CAGN","MSK0056",182239,,,,,,,,"BYCATCH",385,"Kerri Danil",459,"NMFS, SWR, OBSERVER PROGRAM",,,"NMFS, SOUTHWEST REGION FISHERY OBSERVER PROGRAM and SOUTHWEST FISHERIES SCIENCE CENTER",,"SJC",21,"021","C","CETACEA","G gri","Grampus","griseus","Risso's dolphin",,,"N",,"07/25/1992",1992,7,25,"OFFSHORE",,,,"CALIFORNIA","UNITED STATES OF AMERICA",34.433333,1,"Minute",-121.066666,1,"Minute",1,"North Pacific","M","Field determination: gonads were examined; carcass was examined and dissected.",,,,5/31/2012 15:58:10,"dan.prosperi",6/17/2022 15:50:07
1291,,"CAGN","DFP0086",182727,,,,,,,,"BYCATCH",385,"Kerri Danil",459,"NMFS, SWR, OBSERVER PROGRAM",,,"NMFS, SOUTHWEST REGION FISHERY OBSERVER PROGRAM and SOUTHWEST FISHERIES SCIENCE CENTER",,"SJC",21,"021","C","CETACEA","G gri","Grampus","griseus","Risso's dolphin",,,"N",,"01/21/1993",1993,1,21,"OFFSHORE",,,,"CALIFORNIA","UNITED STATES OF AMERICA",32.716666,1,"Minute",-118.95,1,"Minute",1,"North Pacific","F","Field determination: external exam only; live animal or carcass was examined but not dissected.",,,,5/31/2012 15:58:19,"dan.prosperi",6/17/2022 15:50:07
1293,,"CAGN","DFP0098",182729,,,,,,,,"BYCATCH",385,"Kerri Danil",459,"NMFS, SWR, OBSERVER PROGRAM",,,"NMFS, SOUTHWEST REGION FISHERY OBSERVER PROGRAM and SOUTHWEST FISHERIES SCIENCE CENTER",,"SJC",21,"021","C","CETACEA","G gri","Grampus","griseus","Risso's dolphin",,,"N",,"01/24/1993",1993,1,24,"OFFSHORE",,,,"CALIFORNIA","UNITED STATES OF AMERICA",32.716666,1,"Minute",-118.966666,1,"Minute",1,"North Pacific","F","Field determination: external exam only; live animal or carcass was examined but not dissected.",,,,5/31/2012 15:58:19,"dan.prosperi",6/17/2022 15:50:07
1294,,"CAGN","DFP0099",182730,,,,,,,,"BYCATCH",385,"Kerri Danil",459,"NMFS, SWR, OBSERVER PROGRAM",,,"NMFS, SOUTHWEST REGION FISHERY OBSERVER PROGRAM and SOUTHWEST FISHERIES SCIENCE CENTER",,"SJC",21,"021","C","CETACEA","G gri","Grampus","griseus","Risso's dolphin",,,"N",,"01/24/1993",1993,1,24,"OFFSHORE",,,,"CALIFORNIA","UNITED STATES OF AMERICA",32.716666,1,"Minute",-118.966666,1,"Minute",1,"North Pacific","M","Field determination: external exam only; live animal or carcass was examined but not dissected.",,,,5/31/2012 15:58:19,"dan.prosperi",6/17/2022 15:50:07
1301,,"CAGN","WXC0090",182737,,,,,,,,"BYCATCH",385,"Kerri Danil",459,"NMFS, SWR, OBSERVER PROGRAM",,,"NMFS, SOUTHWEST REGION FISHERY OBSERVER PROGRAM and SOUTHWEST FISHERIES SCIENCE CENTER",,"SJC",21,"021","C","CETACEA","G gri","Grampus","griseus","Risso's dolphin",,,"N",,"10/15/1992",1992,10,15,"OFFSHORE",,,,"CALIFORNIA","UNITED STATES OF AMERICA",35.2,1,"Minute",-121.666666,1,"Minute",1,"North Pacific","F","Field determination: gonads were examined; carcass was examined and dissected.",,,,5/31/2012 15:58:19,"dan.prosperi",6/17/2022 15:50:07
1564,,"CAGN","WXC0103",182990,,,,,,,,"BYCATCH",385,"Kerri Danil",459,"NMFS, SWR, OBSERVER PROGRAM",,,"NMFS, SOUTHWEST REGION FISHERY OBSERVER PROGRAM and SOUTHWEST FISHERIES SCIENCE CENTER",,"SJC",21,"021","C","CETACEA","G gri","Grampus","griseus","Risso's dolphin",,,"N",,"11/15/1992",1992,11,15,"OFFSHORE",,,,"CALIFORNIA","UNITED STATES OF AMERICA",38.133333,1,"Minute",-125.983333,1,"Minute",1,"North Pacific","F","Field determination: gonads were examined; carcass was examined and dissected.",,,,5/31/2012 15:58:23,"dan.prosperi",6/17/2022 15:50:07
1875,,"CAGN","EAF0001",183277,,,,,,,,"BYCATCH",385,"Kerri Danil",459,"NMFS, SWR, OBSERVER PROGRAM",,,"NMFS, SOUTHWEST REGION FISHERY OBSERVER PROGRAM and SOUTHWEST FISHERIES SCIENCE CENTER",,"SJC",21,"021","C","CETACEA","G gri","Grampus","griseus","Risso's dolphin",,,"N",,"11/22/1993",1993,11,22,"OFFSHORE",,,,"CALIFORNIA","UNITED STATES OF AMERICA",34.116666,1,"Minute",-121.933333,1,"Minute",1,"North Pacific","M","Field determination: gonads were examined; carcass was examined and dissected.",,,,5/31/2012 15:58:29,"dan.prosperi",6/17/2022 15:50:07
1877,,"CAGN","MGK0123",183279,,,,,,,,"BYCATCH",385,"Kerri Danil",459,"NMFS, SWR, OBSERVER PROGRAM",,,"NMFS, SOUTHWEST REGION FISHERY OBSERVER PROGRAM and SOUTHWEST FISHERIES SCIENCE CENTER",,"SJC",21,"021","C","CETACEA","G gri","Grampus","griseus","Risso's dolphin",,,"N",,"09/16/1993",1993,9,16,"OFFSHORE",,,,"CALIFORNIA","UNITED STATES OF AMERICA",44.4,1,"Minute",-127,1,"Minute",1,"North Pacific","F","Field determination: gonads were examined; carcass was examined and dissected.",,,,5/31/2012 15:58:29,"dan.prosperi",6/17/2022 15:50:07
2165,,"CAGN","MAI0005",183562,,,,,,,,"BYCATCH",385,"Kerri Danil",459,"NMFS, SWR, OBSERVER PROGRAM",,,"NMFS, SOUTHWEST REGION FISHERY OBSERVER PROGRAM and SOUTHWEST FISHERIES SCIENCE CENTER",,"SJC",21,"021","C","CETACEA","G gri","Grampus","griseus","Risso's dolphin",,,"N",,"11/24/1993",1993,11,24,"OFFSHORE",,,,"CALIFORNIA","UNITED STATES OF AMERICA",32.4,1,"Minute",-118.033333,1,"Minute",1,"North Pacific","F","Field determination: external exam only; live animal or carcass was examined but not dissected.",,,,5/31/2012 15:58:33,"dan.prosperi",6/17/2022 15:50:07
2167,,"CAGN","MAI0004",183564,,,,,,,,"BYCATCH",385,"Kerri Danil",459,"NMFS, SWR, OBSERVER PROGRAM",,,"NMFS, SOUTHWEST REGION FISHERY OBSERVER PROGRAM and SOUTHWEST FISHERIES SCIENCE CENTER",,"SJC",21,"021","C","CETACEA","G gri","Grampus","griseus","Risso's dolphin",,,"N",,"11/23/1993",1993,11,23,"OFFSHORE",,,,"CALIFORNIA","UNITED STATES OF AMERICA",32.416666,1,"Minute",-118.133333,1,"Minute",1,"North Pacific","M","Field determination: external exam only; live animal or carcass was examined but not dissected.",,,,5/31/2012 15:58:34,"dan.prosperi",6/17/2022 15:50:07
2668,,,"ZZZ0017",184062,,,,,,,,"BYCATCH",733,"WILLIAM PERRIN",502,"SILLIMAN UNIVERSITY, MARINE LABORATORY C/O SWFSC",,,"Drs. M.L.L. Dolar and W.F. Perrin",,"WFP",21,"021","C","CETACEA","G gri","Grampus","griseus","Risso's dolphin",,,"N",,"??/??/1992",1992,,,,,,,,"PHILIPPINES",,,,,,,1,"North Pacific","U",,,,,5/31/2012 15:58:41,"Alaina.Harmon",4/10/2024 15:00:51
3056,,,"9313071",184444,,,,,,,,"BYCATCH",413,"ANNE COLLET",311,"CENTRE DE RECHERCHE SUR LES MAMMIFERES MARINS",,,,,"SJC",21,"021","C","CETACEA","G gri","Grampus","griseus","Risso's dolphin",,,"N",,"06/17/1993",1993,6,17,"NE ATLANTIC",,,,,,45.016666,1,"Minute",-19.55,1,"Minute",2,"North Atlantic","F","Field determination: gonads were examined; carcass was examined and dissected.",,,"Source was recorded as ""FISHERY-FRANCE""",5/31/2012 15:58:47,"dan.prosperi",6/22/2022 13:55:26
3067,,,"9313072",184455,,,,,,,,"BYCATCH",413,"ANNE COLLET",311,"CENTRE DE RECHERCHE SUR LES MAMMIFERES MARINS",,,,,"SJC",21,"021","C","CETACEA","G gri","Grampus","griseus","Risso's dolphin",,,"N",,"06/17/1993",1993,6,17,"NE ATLANTIC",,,,,,45.016666,1,"Minute",-19.55,1,"Minute",2,"North Atlantic","F","Field determination: gonads were examined; carcass was examined and dissected.",,,"Source was recorded as ""FISHERY-FRANCE""",5/31/2012 15:58:48,"dan.prosperi",6/22/2022 13:55:26
3077,,,"9313151",184465,,,,,,,,"BYCATCH",413,"ANNE COLLET",311,"CENTRE DE RECHERCHE SUR LES MAMMIFERES MARINS",,,,,"SJC",21,"021","C","CETACEA","G gri","Grampus","griseus","Risso's dolphin",,,"N",,"07/30/1993",1993,7,30,"NE ATLANTIC",,,,,,48.033333,1,"Minute",-14.366666,1,"Minute",2,"North Atlantic","M","Field determination: gonads were examined; carcass was examined and dissected.",,,"Source was recorded as ""FISHERY-FRANCE""",5/31/2012 15:58:48,"dan.prosperi",6/22/2022 13:55:26
3170,,,"9313179",184558,,,,,,,,"BYCATCH",413,"ANNE COLLET",311,"CENTRE DE RECHERCHE SUR LES MAMMIFERES MARINS",,,,,"SJC",21,"021","C","CETACEA","G gri","Grampus","griseus","Risso's dolphin",,,"N",,"06/27/1993",1993,6,27,"NE ATLANTIC",,,,,,45.766666,1,"Minute",-18.7,1,"Minute",2,"North Atlantic","F","Field determination: gonads were examined; carcass was examined and dissected.",,,"Source was recorded as ""FISHERY-FRANCE""",5/31/2012 15:58:49,"dan.prosperi",6/22/2022 13:55:26
3982,,,"S-95-GG-05",185362,,,,,,,,"STRANDING",516,"Gretchen Lovewell",416,"MOTE MARINE LAB",,,,,"ARC",21,"021","C","CETACEA","G gri","Grampus","griseus","Risso's dolphin",,,"N",,"??/??/1995",1995,,,,,,,,,,,,,,,2,"North Atlantic","U",,,,"Gretchen is the new contact (after Nelio Barros) for Mote Marine Lab's stranding samples.",5/31/2012 15:59:03,"dan.prosperi",7/1/2022 10:26:53
4551,,,"9312272",185918,,,,,,,,"BYCATCH",413,"ANNE COLLET",311,"CENTRE DE RECHERCHE SUR LES MAMMIFERES MARINS",,,,,"EIA",21,"021","C","CETACEA","G gri","Grampus","griseus","Risso's dolphin",,,"N",,"12/19/1993",1993,12,19,"MEDITERRANEAN",,,,,,,,,,,,2,"North Atlantic","M","Field determination: external exam only; live animal or carcass was examined but not dissected.",,,"Source was recorded as ""FISHERY-FRANCE""",5/31/2012 15:59:12,"dan.prosperi",6/22/2022 13:55:26
4689,,,"MAC951027.03",186056,,"1995-CADDIS-MAC",,,,,,"BIOPSY (PROJECTILE)",534,"JAY BARLOW",1,"SWFSC",,,"Southwest Fisheries Science Center, National Marine Fisheries Service, La Jolla, CA",,"JPB",21,"021","C","CETACEA","G gri","Grampus","griseus","Risso's dolphin",,,"N",,"10/27/1995",1995,10,27,"GULF OF CALIFORNIA",,,,,"MEXICO",24.2,1,"Minute",-108.583333,1,"Minute",1,"North Pacific","M","Molecular determination: ZFX/ZFY 5' exonuclease qPCR assay developed at SWFSC.",,,"Alaina Harmon, 30 April 2024: Samples reverted to no external permission required following Jay Barlow's retirement.",5/31/2012 15:59:14,"Alaina.Harmon",4/30/2024 15:09:06
4690,,,"MAC951027.04",186057,,"1995-CADDIS-MAC",,,,,,"BIOPSY (PROJECTILE)",534,"JAY BARLOW",1,"SWFSC",,,"Southwest Fisheries Science Center, National Marine Fisheries Service, La Jolla, CA",,"JPB",21,"021","C","CETACEA","G gri","Grampus","griseus","Risso's dolphin",,,"N",,"10/27/1995",1995,10,27,"GULF OF CALIFORNIA",,,,,"MEXICO",24.2,1,"Minute",-108.583333,1,"Minute",1,"North Pacific","U",,,,"Alaina Harmon, 30 April 2024: Samples reverted to no external permission required following Jay Barlow's retirement.",5/31/2012 15:59:14,"Alaina.Harmon",4/30/2024 15:09:06
4691,,,"MAC951027.05",186058,,"1995-CADDIS-MAC",,,,,,"BIOPSY (PROJECTILE)",534,"JAY BARLOW",1,"SWFSC",,,"Southwest Fisheries Science Center, National Marine Fisheries Service, La Jolla, CA",,"JPB",21,"021","C","CETACEA","G gri","Grampus","griseus","Risso's dolphin",,,"N",,"10/27/1995",1995,10,27,"GULF OF CALIFORNIA",,,,,"MEXICO",24.2,1,"Minute",-108.583333,1,"Minute",1,"North Pacific","U",,,,"Alaina Harmon, 30 April 2024: Samples reverted to no external permission required following Jay Barlow's retirement.",5/31/2012 15:59:14,"Alaina.Harmon",4/30/2024 15:09:06
4692,,,"MAC951027.06",186059,,"1995-CADDIS-MAC",,,,,,"BIOPSY (PROJECTILE)",534,"JAY BARLOW",1,"SWFSC",,,"Southwest Fisheries Science Center, National Marine Fisheries Service, La Jolla, CA",,"JPB",21,"021","C","CETACEA","G gri","Grampus","griseus","Risso's dolphin",,,"N",,"10/27/1995",1995,10,27,"GULF OF CALIFORNIA",,,,,"MEXICO",24.2,1,"Minute",-108.583333,1,"Minute",1,"North Pacific","U",,,,"Alaina Harmon, 30 April 2024: Samples reverted to no external permission required following Jay Barlow's retirement.",5/31/2012 15:59:14,"Alaina.Harmon",4/30/2024 15:09:06
4694,,"CAGN","RZH0003",186061,,,,,,,,"BYCATCH",385,"Kerri Danil",459,"NMFS, SWR, OBSERVER PROGRAM",,,"NMFS, SOUTHWEST REGION FISHERY OBSERVER PROGRAM and SOUTHWEST FISHERIES SCIENCE CENTER",,"SJC",21,"021","C","CETACEA","G gri","Grampus","griseus","Risso's dolphin",,,"N",,"10/25/1993",1993,10,25,"OFFSHORE",,,,"CALIFORNIA","UNITED STATES OF AMERICA",36.233333,1,"Minute",-122.9,1,"Minute",1,"North Pacific","F","Molecular determination: SRY method",,,"same seqeucne as 8672 accodring to Chivers data",5/31/2012 15:59:14,"dan.prosperi",6/17/2022 15:50:07
4695,,"CAGN","JFB0024",186062,,,,,,,,"BYCATCH",385,"Kerri Danil",459,"NMFS, SWR, OBSERVER PROGRAM",,,"NMFS, SOUTHWEST REGION FISHERY OBSERVER PROGRAM and SOUTHWEST FISHERIES SCIENCE CENTER",,"SJC",21,"021","C","CETACEA","G gri","Grampus","griseus","Risso's dolphin",,,"N",,"09/27/1992",1992,9,27,"OFFSHORE",,,,"CALIFORNIA","UNITED STATES OF AMERICA",35.616666,1,"Minute",-122.116666,1,"Minute",1,"North Pacific","M","Molecular determination: SRY method",,,,5/31/2012 15:59:14,"dan.prosperi",6/17/2022 15:50:07
4771,,"CAGN","HMY0013",186138,,,,,,,,"BYCATCH",385,"Kerri Danil",459,"NMFS, SWR, OBSERVER PROGRAM",,,"NMFS, SOUTHWEST REGION FISHERY OBSERVER PROGRAM and SOUTHWEST FISHERIES SCIENCE CENTER",,"SJC",21,"021","C","CETACEA","G gri","Grampus","griseus","Risso's dolphin",,,"N",,"06/22/1995",1995,6,22,"OFFSHORE",,,,"CALIFORNIA","UNITED STATES OF AMERICA",32.4,1,"Minute",-119,1,"Minute",1,"North Pacific","F","Molecular determination: SRY method",,,,5/31/2012 15:59:15,"dan.prosperi",6/17/2022 15:50:07
4975,,,"USNM571492",186316,,,,,,,,"STRANDING",470,"Darrin Lunde",256,"DIVISION OF MAMMALS, SMITHSONIAN INSTITUTION",,,"National Museum of Natural History, Smithsonian Institute",,"ARC",21,"021","C","CETACEA","G gri","Grampus","griseus","Risso's dolphin",,,"Y","Donator requested that PI request permission to use in study","01/14/1992",1992,1,14,,,"Parramore Island","Accomack","VIRGINIA","UNITED STATES OF AMERICA",37.533333,1,"Minute",-75.616666,1,"Minute",2,"North Atlantic","F","Field determination: external exam only; live animal or carcass was examined but not dissected.",,,"Include USNM accession number in Ack; Charlie Potter original contributor.  Source was recorded as ""STRAND-USNM""",5/31/2012 15:59:19,"dan.prosperi",6/22/2022 14:15:26
5001,,"CAGN","LMH0075",186342,,,,,,,,"BYCATCH",385,"Kerri Danil",459,"NMFS, SWR, OBSERVER PROGRAM",,,"NMFS, SOUTHWEST REGION FISHERY OBSERVER PROGRAM and SOUTHWEST FISHERIES SCIENCE CENTER",,"SJC",21,"021","C","CETACEA","G gri","Grampus","griseus","Risso's dolphin",,,"N",,"10/29/1995",1995,10,29,"OFFSHORE",,,,"CALIFORNIA","UNITED STATES OF AMERICA",34.55,1,"Minute",-120.9,1,"Minute",1,"North Pacific","F","Field determination: gonads were examined; carcass was examined and dissected.",,,,5/31/2012 15:59:22,"dan.prosperi",6/17/2022 15:50:07
5004,,"CAGN","LMH0078",186345,,,,,,,,"BYCATCH",385,"Kerri Danil",459,"NMFS, SWR, OBSERVER PROGRAM",,,"NMFS, SOUTHWEST REGION FISHERY OBSERVER PROGRAM and SOUTHWEST FISHERIES SCIENCE CENTER",,"SJC",21,"021","C","CETACEA","G gri","Grampus","griseus","Risso's dolphin",,,"N",,"10/29/1995",1995,10,29,"OFFSHORE",,,,"CALIFORNIA","UNITED STATES OF AMERICA",34.55,1,"Minute",-120.9,1,"Minute",1,"North Pacific","M","Molecular determination: SRY method",,,,5/31/2012 15:59:22,"dan.prosperi",6/17/2022 15:50:07
5007,,"CAGN","BCO0013",186348,,,,,,,,"BYCATCH",385,"Kerri Danil",459,"NMFS, SWR, OBSERVER PROGRAM",,,"NMFS, SOUTHWEST REGION FISHERY OBSERVER PROGRAM and SOUTHWEST FISHERIES SCIENCE CENTER",,"SJC",21,"021","C","CETACEA","G gri","Grampus","griseus","Risso's dolphin",,,"N",,"10/29/1995",1995,10,29,"OFFSHORE",,,,"CALIFORNIA","UNITED STATES OF AMERICA",34.533333,1,"Minute",-120.866666,1,"Minute",1,"North Pacific","F","Field determination: gonads were examined; carcass was examined and dissected.",,,,5/31/2012 15:59:22,"dan.prosperi",6/17/2022 15:50:07
5008,,"CAGN","BCO0014",186349,,,,,,,,"BYCATCH",385,"Kerri Danil",459,"NMFS, SWR, OBSERVER PROGRAM",,,"NMFS, SOUTHWEST REGION FISHERY OBSERVER PROGRAM and SOUTHWEST FISHERIES SCIENCE CENTER",,"SJC",21,"021","C","CETACEA","G gri","Grampus","griseus","Risso's dolphin",,,"N",,"10/29/1995",1995,10,29,"OFFSHORE",,,,"CALIFORNIA","UNITED STATES OF AMERICA",34.533333,1,"Minute",-120.866666,1,"Minute",1,"North Pacific","M","Molecular determination: SRY method",,,,5/31/2012 15:59:22,"dan.prosperi",6/17/2022 15:50:07
5074,,,"CC-0123",186414,,,,,,,,"STRANDING",593,"LANCE CLARK",521,"TEXAS MARINE MAMMAL STRANDING NETWORK",,,,,"ARC",21,"021","C","CETACEA","G gri","Grampus","griseus","Risso's dolphin",,,"N",,"04/24/1993",1993,4,24,"NATIONAL SEASHORE",,"Padre Island",,"TEXAS","UNITED STATES OF AMERICA",27.383333,1,"Minute",-97.35,1,"Minute",2,"North Atlantic","F","Field determination: gonads were examined; carcass was examined and dissected.",,,,5/31/2012 15:59:23,"dan.prosperi",6/24/2022 15:53:24
6157,,,"DSJ960905.11",186894,,"1996-ORCAWALE-DSJ",,,,,,"BIOPSY (PROJECTILE)",534,"JAY BARLOW",1,"SWFSC",,,"Southwest Fisheries Science Center, National Marine Fisheries Service, La Jolla, CA",,"JPB",21,"021","C","CETACEA","G gri","Grampus","griseus","Risso's dolphin",,,"N",,"09/05/1996",1996,9,5,"OFFSHORE",,,,"CALIFORNIA","UNITED STATES OF AMERICA",33.283333,1,"Minute",-118.983333,1,"Minute",1,"North Pacific","U",,,,"Alaina Harmon, 30 April 2024: Samples reverted to no external permission required following Jay Barlow's retirement.",5/31/2012 15:59:39,"Alaina.Harmon",4/30/2024 15:09:19
6963,,,"C70",187403,,,,,,,,"STRANDING",383,"Barbie Halaska",4,"The Marine Mammal Center",,,"The Marine Mammal Center, Sausalito, CA",,"SJC",21,"021","C","CETACEA","G gri","Grampus","griseus","Risso's dolphin",,,"N",,"03/27/1997",1997,3,27,"WILDER RANCH",,,"Santa Cruz","CALIFORNIA","UNITED STATES OF AMERICA",36.966666,1,"Minute",-122.083333,1,"Minute",1,"North Pacific","M","Field determination: gonads were examined; carcass was examined and dissected.",,,,5/31/2012 15:59:51,"dan.prosperi",6/14/2022 10:00:08
7447,,,"MIA-063",187845,,,,,,,,"STRANDING",464,"DAN ODELL",497,"SEA WORLD OF FLORIDA",,,,,"SJC",21,"021","C","CETACEA","G gri","Grampus","griseus","Risso's dolphin",,,"N",,"12/14/1992",1992,12,14,"POMPANO BEACH",,,,"FLORIDA","UNITED STATES OF AMERICA",26.2,1,"Minute",-80.083333,1,"Minute",2,"North Atlantic","M","Field determination: gonads were examined; carcass was examined and dissected.",,,"changed to not use restircted 2021 after 20 years of no permission contact.  nearly all samples were made available to us by N. Barros, Dan Odell not interested in monitoring, made not use restricted",5/31/2012 15:59:59,"dan.prosperi",6/8/2022 7:21:53
7629,,,"KS97-02PUSAN",187949,,,,,,,,"MARKET",669,"Robert Brownell",250,"NMFS, SOUTHWEST FISHERIES SCIENCE CENTER - SANTA CRUZ",,,,,"RLB",21,"021","C","CETACEA","G gri","Grampus","griseus","Risso's dolphin",,,"Y","Donator requested that PI request permission to use in study","??/??/1997",1997,,,,,,,,,,,,,,,9,"Unknown","U",,,,"Source was recorded as ""FORENSICS-KOREAN MARKET""",5/31/2012 16:00:02,"dan.prosperi",6/16/2022 14:43:13
7778,,,"ALB970708.09",188075,,,,,,,,"BIOPSY (PROJECTILE)",,,46,"Northeast Fisheries Science Center",,,,,"SJC",21,"021","C","CETACEA","G gri","Grampus","griseus","Risso's dolphin",,,"N",,"07/08/1997",1997,7,8,"NW ATLANTIC",,,,,"UNITED STATES OF AMERICA",40.116666,1,"Minute",-68.783333,1,"Minute",2,"North Atlantic","U",,,,"Many collected by R. L. Pitman.  Source was recorded as ""BIOPSY-NEFSC PERMIT""",5/31/2012 16:00:04,"dan.prosperi",6/24/2022 9:16:42
7779,,,"ALB970708.10",188076,,,,,,,,"BIOPSY (PROJECTILE)",,,46,"Northeast Fisheries Science Center",,,,,"SJC",21,"021","C","CETACEA","G gri","Grampus","griseus","Risso's dolphin",,,"N",,"07/08/1997",1997,7,8,"NW ATLANTIC",,,,,"UNITED STATES OF AMERICA",40.116666,1,"Minute",-68.783333,1,"Minute",2,"North Atlantic","F","Molecular determination: ZFX/ZFY 5' exonuclease qPCR assay developed at SWFSC.",,,"Many collected by R. L. Pitman.  Source was recorded as ""BIOPSY-NEFSC PERMIT""",5/31/2012 16:00:04,"dan.prosperi",6/24/2022 9:16:42
8672,,,"S-97-GM-09",188883,,,,,,,,"STRANDING",464,"DAN ODELL",497,"SEA WORLD OF FLORIDA",,,,,"SJC",21,"021","C","CETACEA","G gri","Grampus","griseus","Risso's dolphin",,,"N",,"03/27/1997",1997,3,27,"ORMOND BEACH",,,"Volusia","FLORIDA","UNITED STATES OF AMERICA",29.283333,1,"Minute",-81.033333,1,"Minute",2,"North Atlantic","F","Field determination: gonads were examined; carcass was examined and dissected.",,,"97% match w/grampus in Macmatch, changed to not use restircted 2021 after 20 years of no permission contact.  nearly all samples were made available to us by N. Barros, Dan Odell not interested in monitoring, made not use restricted",5/31/2012 16:00:19,"dan.prosperi",6/8/2022 7:21:53
8682,,,"S-97-GG-24",188893,,,,,,,,"STRANDING",464,"DAN ODELL",497,"SEA WORLD OF FLORIDA",,,,,"SJC",21,"021","C","CETACEA","G gri","Grampus","griseus","Risso's dolphin",,,"N",,"10/07/1997",1997,10,7,"CHATHAM",,"Ossabaw Island",,"GEORGIA","UNITED STATES OF AMERICA",30.766666,1,"Minute",-81.066666,1,"Minute",2,"North Atlantic","M","Field determination: external exam only; live animal or carcass was examined but not dissected.",,,"nearly all samples were made available to us by N. Barros, Dan Odell not interested in monitoring, made not use restricted",5/31/2012 16:00:19,"dan.prosperi",6/8/2022 7:21:53
8759,,"CAGN","AXR0005",188929,,,,,,,,"BYCATCH",385,"Kerri Danil",459,"NMFS, SWR, OBSERVER PROGRAM",,,"NMFS, SOUTHWEST REGION FISHERY OBSERVER PROGRAM and SOUTHWEST FISHERIES SCIENCE CENTER",,"SJC",21,"021","C","CETACEA","G gri","Grampus","griseus","Risso's dolphin",,,"N",,"09/30/1997",1997,9,30,"OFFSHORE",,,,"CALIFORNIA","UNITED STATES OF AMERICA",32.85,1,"Minute",-117.5,1,"Minute",1,"North Pacific","M","Field determination: gonads were examined; carcass was examined and dissected.",,,"Sp. ID per head, confirmed by R. Brownell",5/31/2012 16:00:20,"dan.prosperi",6/17/2022 15:50:07
9335,,"CAGN","SMC0028",189261,,,,,,,,"BYCATCH",385,"Kerri Danil",459,"NMFS, SWR, OBSERVER PROGRAM",,,"NMFS, SOUTHWEST REGION FISHERY OBSERVER PROGRAM and SOUTHWEST FISHERIES SCIENCE CENTER",,"SJC",21,"021","C","CETACEA","G gri","Grampus","griseus","Risso's dolphin",,,"N",,"11/28/1997",1997,11,28,"OFFSHORE",,,,"CALIFORNIA","UNITED STATES OF AMERICA",36.416666,1,"Minute",-122.216666,1,"Minute",1,"North Pacific","M","Field determination: gonads were examined; carcass was examined and dissected.",,,,5/31/2012 16:00:32,"dan.prosperi",6/17/2022 15:50:07
9336,,"CAGN","SMC0029",189262,,,,,,,,"BYCATCH",385,"Kerri Danil",459,"NMFS, SWR, OBSERVER PROGRAM",,,"NMFS, SOUTHWEST REGION FISHERY OBSERVER PROGRAM and SOUTHWEST FISHERIES SCIENCE CENTER",,"SJC",21,"021","C","CETACEA","G gri","Grampus","griseus","Risso's dolphin",,,"N",,"11/28/1997",1997,11,28,"OFFSHORE",,,,"CALIFORNIA","UNITED STATES OF AMERICA",36.416666,1,"Minute",-122.216666,1,"Minute",1,"North Pacific","F","Field determination: gonads were examined; carcass was examined and dissected.",,,,5/31/2012 16:00:32,"dan.prosperi",6/17/2022 15:50:07
9556,,,"CK9401",189480,,,,,,,,"STRANDING",600,"Lien-Siang Chou",431,"NATIONAL TAIWAN UNIVERSITY",,,"Dr. Lien Siang-Chou, National Taiwan University, Taipei, Taiwan",,"SJC",21,"021","C","CETACEA","G gri","Grampus","griseus","Risso's dolphin",,,"N",,"??/??/????",,,,,,,,,"TAIWAN, PROVINCE OF CHINA",,,,,,,1,"North Pacific","U",,,,"Source was recorded as ""STRAND-TAIWAN-CHOU""",5/31/2012 16:00:36,"dan.prosperi",6/24/2022 7:18:03
9557,,,"CK9716",189481,,,,,,,,"STRANDING",600,"Lien-Siang Chou",431,"NATIONAL TAIWAN UNIVERSITY",,,"Dr. Lien Siang-Chou, National Taiwan University, Taipei, Taiwan",,"SJC",21,"021","C","CETACEA","G gri","Grampus","griseus","Risso's dolphin",,,"N",,"??/??/????",,,,,,,,,"TAIWAN, PROVINCE OF CHINA",,,,,,,1,"North Pacific","U",,,,"Source was recorded as ""STRAND-TAIWAN-CHOU""",5/31/2012 16:00:36,"dan.prosperi",6/24/2022 7:18:03
9558,,,"PE9712",189482,,,,,,,,"STRANDING",600,"Lien-Siang Chou",431,"NATIONAL TAIWAN UNIVERSITY",,,"Dr. Lien Siang-Chou, National Taiwan University, Taipei, Taiwan",,"SJC",21,"021","C","CETACEA","G gri","Grampus","griseus","Risso's dolphin",,,"N",,"??/??/????",,,,,,,,,"TAIWAN, PROVINCE OF CHINA",,,,,,,1,"North Pacific","U",,,,"Source was recorded as ""STRAND-TAIWAN-CHOU""",5/31/2012 16:00:36,"dan.prosperi",6/24/2022 7:18:03
11204,,,"SBMNH98-8",190532,,,,,,,,"STRANDING",350,"Michelle Berman",10,"Santa Barbara Museum of Natural History",,,"YES, AND NOTIFY OF USE",,"KMR",21,"021","C","CETACEA","G gri","Grampus","griseus","Risso's dolphin",,,"N",,"08/11/1998",1998,8,11,"SANTA BARBARA",,,,"CALIFORNIA","UNITED STATES OF AMERICA",34.416666,1,"Minute",-119.666666,1,"Minute",1,"North Pacific","F","Field determination: gonads were examined; carcass was examined and dissected.",,,"Sample use not restricted, but would like to be acknowledeged.",5/31/2012 16:01:07,"dan.prosperi",6/23/2022 14:04:57
11692,,,"DSJ981129.06",190875,,"1998-SPAM-DSJ",,,,,,"BIOPSY (PROJECTILE)",713,"TIM GERRODETTE",1,"SWFSC",,,"Southwest Fisheries Science Center, National Marine Fisheries Service, La Jolla, CA",,"T_G",21,"021","C","CETACEA","G gri","Grampus","griseus","Risso's dolphin",,,"N",,"11/29/1998",1998,11,29,,,,,,"MEXICO",16.65,1,"Minute",-100.566666,1,"Minute",1,"North Pacific","U",,,,"Gerrodette retired, samples changed to NOT use restricted",5/31/2012 16:01:14,"dan.prosperi",4/10/2024 7:53:40
11693,,,"DSJ981129.07",190876,,"1998-SPAM-DSJ",,,,,,"BIOPSY (PROJECTILE)",713,"TIM GERRODETTE",1,"SWFSC",,,"Southwest Fisheries Science Center, National Marine Fisheries Service, La Jolla, CA",,"T_G",21,"021","C","CETACEA","G gri","Grampus","griseus","Risso's dolphin",,,"N",,"11/29/1998",1998,11,29,,,,,,"MEXICO",16.65,1,"Minute",-100.566666,1,"Minute",1,"North Pacific","U",,,,"Gerrodette retired, samples changed to NOT use restricted",5/31/2012 16:01:14,"dan.prosperi",4/10/2024 7:53:40
11694,,,"DSJ981129.08",190877,,"1998-SPAM-DSJ",,,,,,"BIOPSY (PROJECTILE)",713,"TIM GERRODETTE",1,"SWFSC",,,"Southwest Fisheries Science Center, National Marine Fisheries Service, La Jolla, CA",,"T_G",21,"021","C","CETACEA","G gri","Grampus","griseus","Risso's dolphin",,,"N",,"11/29/1998",1998,11,29,,,,,,"MEXICO",16.65,1,"Minute",-100.566666,1,"Minute",1,"North Pacific","U",,,,"Gerrodette retired, samples changed to NOT use restricted",5/31/2012 16:01:14,"dan.prosperi",4/10/2024 7:53:40
12306,,,"GGRI99-01-30",191278,,,,,,,,"STRANDING",383,"Barbie Halaska",4,"The Marine Mammal Center",,,"The Marine Mammal Center, Sausalito, CA",,"SJC",21,"021","C","CETACEA","G gri","Grampus","griseus","Risso's dolphin",,,"N",,"01/30/1999",1999,1,30,"CAMBRIA",,,,"CALIFORNIA","UNITED STATES OF AMERICA",35.55,1,"Minute",-121.066666,1,"Minute",1,"North Pacific","M","Field determination: gonads were examined; carcass was examined and dissected.",,,"Sample is really a G gri not P mac.  Suspect is same as 12307.  Dloop sequences are identical per KMR.",5/31/2012 16:01:23,"dan.prosperi",6/14/2022 10:00:08
12307,,,"C88",191279,,,,,,,,"STRANDING",383,"Barbie Halaska",4,"The Marine Mammal Center",,,"The Marine Mammal Center, Sausalito, CA",,"SJC",21,"021","C","CETACEA","G gri","Grampus","griseus","Risso's dolphin",,,"N",,"02/18/1999",1999,2,18,"BEAN HOLLOW",,,,"TEXAS","UNITED STATES OF AMERICA",37.2,1,"Minute",-122.366666,1,"Minute",1,"North Pacific","F","Field determination: gonads were examined; carcass was examined and dissected.",,,,5/31/2012 16:01:24,"dan.prosperi",6/24/2022 8:10:30
13860,,,"SK-99-14",192143,,,,,,,,"MARKET",669,"Robert Brownell",250,"NMFS, SOUTHWEST FISHERIES SCIENCE CENTER - SANTA CRUZ",,,,,"RLB",21,"021","C","CETACEA","G gri","Grampus","griseus","Risso's dolphin",,,"Y","Donator requested that PI request permission to use in study","??/??/1999",1999,,,,,,,,,,,,,,,9,"Unknown","U",,,,"Source was recorded as ""FORENSICS-KOREAN MARKET""",5/31/2012 16:01:48,"dan.prosperi",6/16/2022 14:43:13
13876,,,"SK-99-29",192159,,,,,,,,"MARKET",669,"Robert Brownell",250,"NMFS, SOUTHWEST FISHERIES SCIENCE CENTER - SANTA CRUZ",,,,,"RLB",21,"021","C","CETACEA","G gri","Grampus","griseus","Risso's dolphin",,,"Y","Donator requested that PI request permission to use in study","??/??/1999",1999,,,,,,,,,,,,,,,9,"Unknown","U",,,,"Source was recorded as ""FORENSICS-KOREAN MARKET""",5/31/2012 16:01:48,"dan.prosperi",6/16/2022 14:43:13
15899,,,"DSJ990811.02",193264,,"1999-STAR-DSJ",,,,,,"BIOPSY (PROJECTILE)",603,"LISA Ballance",1,"SWFSC",,,"Southwest Fisheries Science Center, National Marine Fisheries Service, La Jolla, CA",,"ARC",21,"021","C","CETACEA","G gri","Grampus","griseus","Risso's dolphin",,,"N",,"08/11/1999",1999,8,11,,,,,,"MEXICO",25.65,1,"Minute",-110.216666,1,"Minute",1,"North Pacific","U",,6/28/2000 0:00:00,,"use restriction changed to NO in 2020 due to Ballance retirement; contact E. Archer if questions",5/31/2012 16:02:22,"dan.prosperi",4/10/2024 8:04:08
15900,,,"DSJ990811.03",193265,,"1999-STAR-DSJ",,,,,,"BIOPSY (PROJECTILE)",603,"LISA Ballance",1,"SWFSC",,,"Southwest Fisheries Science Center, National Marine Fisheries Service, La Jolla, CA",,"ARC",21,"021","C","CETACEA","G gri","Grampus","griseus","Risso's dolphin",,,"N",,"08/11/1999",1999,8,11,,,,,,"MEXICO",25.65,1,"Minute",-110.216666,1,"Minute",1,"North Pacific","U",,6/28/2000 0:00:00,,"use restriction changed to NO in 2020 due to Ballance retirement; contact E. Archer if questions",5/31/2012 16:02:22,"dan.prosperi",4/10/2024 8:04:08
15901,,,"DSJ990811.04",193266,,"1999-STAR-DSJ",,,,,,"BIOPSY (PROJECTILE)",603,"LISA Ballance",1,"SWFSC",,,"Southwest Fisheries Science Center, National Marine Fisheries Service, La Jolla, CA",,"ARC",21,"021","C","CETACEA","G gri","Grampus","griseus","Risso's dolphin",,,"N",,"08/11/1999",1999,8,11,,,,,,"MEXICO",25.583333,1,"Minute",-110.066666,1,"Minute",1,"North Pacific","U",,6/28/2000 0:00:00,,"use restriction changed to NO in 2020 due to Ballance retirement; contact E. Archer if questions",5/31/2012 16:02:22,"dan.prosperi",4/10/2024 8:04:08
15997,,,"DSJ990913.01",193362,,"1999-STAR-DSJ",,,,,,"BIOPSY (PROJECTILE)",603,"LISA Ballance",1,"SWFSC",,,"Southwest Fisheries Science Center, National Marine Fisheries Service, La Jolla, CA",,"ARC",21,"021","C","CETACEA","G gri","Grampus","griseus","Risso's dolphin",,,"N",,"09/13/1999",1999,9,13,,,,,,"MEXICO",16.65,1,"Minute",-99.933333,1,"Minute",1,"North Pacific","U",,6/28/2000 0:00:00,,"use restriction changed to NO in 2020 due to Ballance retirement; contact E. Archer if questions",5/31/2012 16:02:24,"dan.prosperi",4/10/2024 8:04:08
23155,,"CAGN","EPM0196",195157,,,,,,,,"BYCATCH",385,"Kerri Danil",459,"NMFS, SWR, OBSERVER PROGRAM",,,"NMFS, SOUTHWEST REGION FISHERY OBSERVER PROGRAM and SOUTHWEST FISHERIES SCIENCE CENTER",,"SJC",21,"021","C","CETACEA","G gri","Grampus","griseus","Risso's dolphin",,,"N",,"05/20/2000",2000,5,20,"OFFSHORE (DRIFTNET)",,,,"CALIFORNIA","UNITED STATES OF AMERICA",32.283333,1,"Minute",-118.933333,1,"Minute",1,"North Pacific","F","Field determination: gonads were examined; carcass was examined and dissected.",3/6/2001 0:00:00,,,5/31/2012 16:04:18,"dan.prosperi",6/17/2022 15:50:07
23187,,"CAGN","TMR0076",195189,,,,,,,,"BYCATCH",385,"Kerri Danil",459,"NMFS, SWR, OBSERVER PROGRAM",,,"NMFS, SOUTHWEST REGION FISHERY OBSERVER PROGRAM and SOUTHWEST FISHERIES SCIENCE CENTER",,"SJC",21,"021","C","CETACEA","G gri","Grampus","griseus","Risso's dolphin",,,"N",,"09/24/2000",2000,9,24,"OFFSHORE (DRIFTNET)",,,,"CALIFORNIA","UNITED STATES OF AMERICA",35.8,1,"Minute",-122.233333,1,"Minute",1,"North Pacific","F","Field determination: gonads were examined; carcass was examined and dissected.",3/6/2001 0:00:00,,,5/31/2012 16:04:18,"dan.prosperi",6/17/2022 15:50:07
23799,,,"HYDE010610.05",195540,,,,,,,,"BIOPSY (PROJECTILE)",552,"JOHN HYDE",1,"SWFSC",,,"J. Hyde, Southwest Fisheries Science Center, National Marine Fisheries Service, La Jolla, CA",,"JRH",21,"021","C","CETACEA","G gri","Grampus","griseus","Risso's dolphin",,,"N",,"06/10/2001",2001,6,10,"OFFSHORE",,,"San Diego","CALIFORNIA","UNITED STATES OF AMERICA",32.833333,1,"Minute",-117.35,1,"Minute",1,"North Pacific","U",,6/20/2001 0:00:00,,,5/31/2012 16:04:28,"dan.prosperi",6/10/2022 15:06:32
23800,,,"HYDE010610.06",195541,,,,,,,,"BIOPSY (PROJECTILE)",552,"JOHN HYDE",1,"SWFSC",,,"J. Hyde, Southwest Fisheries Science Center, National Marine Fisheries Service, La Jolla, CA",,"JRH",21,"021","C","CETACEA","G gri","Grampus","griseus","Risso's dolphin",,,"N",,"06/10/2001",2001,6,10,"OFFSHORE",,,"San Diego","CALIFORNIA","UNITED STATES OF AMERICA",32.9,1,"Minute",-117.35,1,"Minute",1,"North Pacific","U",,6/20/2001 0:00:00,,,5/31/2012 16:04:28,"dan.prosperi",6/10/2022 15:06:32
23942,,,"KZP0081",195652,,,,,,,,"STRANDING",398,"STRANDING COORDINATOR ",1,"SWFSC",,,"NMFS, Southwest Fisheries Science Center",,"K_D",21,"021","C","CETACEA","G gri","Grampus","griseus","Risso's dolphin",,,"N",,"06/14/2001",2001,6,14,"CARLSBAD, SOUTH PONTO BEACH",,,"San Diego","CALIFORNIA","UNITED STATES OF AMERICA",33.083333,1,"Minute",-117.316666,1,"Minute",1,"North Pacific","F","Field determination: gonads were examined; carcass was examined and dissected.",7/3/2001 0:00:00,,,5/31/2012 16:04:30,"dan.prosperi",6/8/2022 7:21:53
25435,,,"DSJ010921.10",196556,,"2001-ORCAWALE-DSJ",,,,,,"BIOPSY (PROJECTILE)",534,"JAY BARLOW",1,"SWFSC",,,"Southwest Fisheries Science Center, National Marine Fisheries Service, La Jolla, CA",,"JPB",21,"021","C","CETACEA","G gri","Grampus","griseus","Risso's dolphin",,,"N",,"09/21/2001",2001,9,21,"WEST COAST",,,,,"UNITED STATES OF AMERICA",43.016666,1,"Minute",-124.583333,1,"Minute",1,"North Pacific","U",,10/24/2001 0:00:00,,"Alaina Harmon, 30 April 2024: Samples reverted to no external permission required following Jay Barlow's retirement.",5/31/2012 16:04:56,"Alaina.Harmon",4/30/2024 15:09:07
26306,,,"DSJ011109.03",196839,,"2001-ORCAWALE-DSJ",,,,,,"BIOPSY (PROJECTILE)",534,"JAY BARLOW",1,"SWFSC",,,"Southwest Fisheries Science Center, National Marine Fisheries Service, La Jolla, CA",,"JPB",21,"021","C","CETACEA","G gri","Grampus","griseus","Risso's dolphin",,,"N",,"11/09/2001",2001,11,9,"WEST COAST",,,,,"UNITED STATES OF AMERICA",34.016666,1,"Minute",-119.366666,1,"Minute",1,"North Pacific","U",,12/14/2001 0:00:00,,"Alaina Harmon, 30 April 2024: Samples reverted to no external permission required following Jay Barlow's retirement.",5/31/2012 16:05:11,"Alaina.Harmon",4/30/2024 15:09:08
26307,,,"DSJ011109.04",196840,,"2001-ORCAWALE-DSJ",,,,,,"BIOPSY (PROJECTILE)",534,"JAY BARLOW",1,"SWFSC",,,"Southwest Fisheries Science Center, National Marine Fisheries Service, La Jolla, CA",,"JPB",21,"021","C","CETACEA","G gri","Grampus","griseus","Risso's dolphin",,,"N",,"11/09/2001",2001,11,9,"WEST COAST",,,,,"UNITED STATES OF AMERICA",34.016666,1,"Minute",-119.366666,1,"Minute",1,"North Pacific","U",,12/14/2001 0:00:00,,"Alaina Harmon, 30 April 2024: Samples reverted to no external permission required following Jay Barlow's retirement.",5/31/2012 16:05:11,"Alaina.Harmon",4/30/2024 15:09:08
26308,,,"DSJ011109.05",196841,,"2001-ORCAWALE-DSJ",,,,,,"BIOPSY (PROJECTILE)",534,"JAY BARLOW",1,"SWFSC",,,"Southwest Fisheries Science Center, National Marine Fisheries Service, La Jolla, CA",,"JPB",21,"021","C","CETACEA","G gri","Grampus","griseus","Risso's dolphin",,,"N",,"11/09/2001",2001,11,9,"WEST COAST",,,,,"UNITED STATES OF AMERICA",34.016666,1,"Minute",-119.366666,1,"Minute",1,"North Pacific","U",,12/14/2001 0:00:00,,"Alaina Harmon, 30 April 2024: Samples reverted to no external permission required following Jay Barlow's retirement.",5/31/2012 16:05:11,"Alaina.Harmon",4/30/2024 15:09:08
26309,,,"DSJ011109.06",196842,,"2001-ORCAWALE-DSJ",,,,,,"BIOPSY (PROJECTILE)",534,"JAY BARLOW",1,"SWFSC",,,"Southwest Fisheries Science Center, National Marine Fisheries Service, La Jolla, CA",,"JPB",21,"021","C","CETACEA","G gri","Grampus","griseus","Risso's dolphin",,,"N",,"11/09/2001",2001,11,9,"WEST COAST",,,,,"UNITED STATES OF AMERICA",34.016666,1,"Minute",-119.366666,1,"Minute",1,"North Pacific","U",,12/14/2001 0:00:00,,"Alaina Harmon, 30 April 2024: Samples reverted to no external permission required following Jay Barlow's retirement.",5/31/2012 16:05:11,"Alaina.Harmon",4/30/2024 15:09:08
26642,,,"KXD0020",196988,,,,,,,,"STRANDING",398,"STRANDING COORDINATOR ",1,"SWFSC",,,"NMFS, Southwest Fisheries Science Center",,"K_D",21,"021","C","CETACEA","G gri","Grampus","griseus","Risso's dolphin",,,"N",,"02/06/2002",2002,2,6,"SAN ONOFRE STATE BEACH",,,"San Diego","CALIFORNIA","UNITED STATES OF AMERICA",33.366666,1,"Minute",-117.566666,1,"Minute",1,"North Pacific","M","Field determination: gonads were examined; carcass was examined and dissected.",3/13/2002 0:00:00,,"2nd VIAL IS MUSCLE; FISHERY INTERACTION",5/31/2012 16:05:16,"dan.prosperi",2/6/2023 9:01:53
26643,,,"KXD0021",196989,,,,,,,,"STRANDING",398,"STRANDING COORDINATOR ",1,"SWFSC",,,"NMFS, Southwest Fisheries Science Center",,"K_D",21,"021","C","CETACEA","G gri","Grampus","griseus","Risso's dolphin",,,"N",,"02/07/2002",2002,2,7,"SAN CLEMENTE CITY BEACH",,,,"CALIFORNIA","UNITED STATES OF AMERICA",33.416666,1,"Minute",-117.616666,1,"Minute",1,"North Pacific","M","Field determination: gonads were examined; carcass was examined and dissected.",3/13/2002 0:00:00,,,5/31/2012 16:05:16,"dan.prosperi",6/8/2022 7:21:53
28480,,,"HYDE020809.09",198068,,,,,,,,"BIOPSY (PROJECTILE)",552,"JOHN HYDE",1,"SWFSC",,,"J. Hyde, Southwest Fisheries Science Center, National Marine Fisheries Service, La Jolla, CA",,"JRH",21,"021","C","CETACEA","G gri","Grampus","griseus","Risso's dolphin",,,"N",,"08/09/2002",2002,8,9,"OFFSHORE",,,"San Diego","CALIFORNIA","UNITED STATES OF AMERICA",32.883333,1,"Minute",-117.4,1,"Minute",1,"North Pacific","U",,9/11/2002 0:00:00,,,5/31/2012 16:05:46,"dan.prosperi",6/10/2022 15:06:32
32931,,,"MLMLMM504",200726,,,,,,,,"STRANDING",543,"JIM HARVEY",7,"Moss Landing Marine Laboratories",,,"Moss Landing Marine Laboratories, CA Stranding Network Participants",,"KMR",21,"021","C","CETACEA","G gri","Grampus","griseus","Risso's dolphin",,,"N",,"08/01/1997",1997,8,1,"CARMEL, GARRAPATA ST. PARK, GARRAPATA BEACH",,,"Monterey","CALIFORNIA","UNITED STATES OF AMERICA",36.45,1,"Minute",-121.9,1,"Minute",1,"North Pacific","M","Field determination: gonads were examined; carcass was examined and dissected.",5/14/2003 0:00:00,,"Additional Contact:  P.O. BOX 450, TIFFINI BROOKENS-TJBROOKEN@AOL.COM",5/31/2012 16:07:00,"dan.prosperi",6/21/2022 9:17:40
32940,,,"MLMLMM979",200735,,,,,,,,"STRANDING",543,"JIM HARVEY",7,"Moss Landing Marine Laboratories",,,"Moss Landing Marine Laboratories, CA Stranding Network Participants",,"KMR",21,"021","C","CETACEA","G gri","Grampus","griseus","Risso's dolphin",,,"N",,"01/01/2003",2003,1,1,"MONTEREY, MOSS LANDING, ML STATE BEACH 1.5 MILE N.JETTY",,,,"CALIFORNIA","UNITED STATES OF AMERICA",36.816666,1,"Minute",-121.8,1,"Minute",1,"North Pacific","F","Field determination: external exam only; live animal or carcass was examined but not dissected.",5/14/2003 0:00:00,,"Additional Contact:  P.O. BOX 450, TIFFINI BROOKENS-TJBROOKEN@AOL.COM",5/31/2012 16:07:00,"dan.prosperi",6/21/2022 9:17:40
37967,,,"DSJ030810.05",203243,,"2003-STAR-DSJ",,,,,,"BIOPSY (PROJECTILE)",603,"LISA Ballance",1,"SWFSC",,,"Southwest Fisheries Science Center, National Marine Fisheries Service, La Jolla, CA",,"ARC",21,"021","C","CETACEA","G gri","Grampus","griseus","Risso's dolphin",,,"N",,"08/10/2003",2003,8,10,,,,,,"MEXICO",24.183333,1,"Minute",-109.366666,1,"Minute",1,"North Pacific","U",,1/12/2004 0:00:00,,"A-1 S(DMSO).  use restriction changed to NO in 2020 due to Ballance retirement; contact E. Archer if questions",5/31/2012 16:08:23,"dan.prosperi",4/10/2024 10:11:22
37971,,,"DSJ030811.04",203247,,"2003-STAR-DSJ",,,,,,"BIOPSY (PROJECTILE)",603,"LISA Ballance",1,"SWFSC",,,"Southwest Fisheries Science Center, National Marine Fisheries Service, La Jolla, CA",,"ARC",21,"021","C","CETACEA","G gri","Grampus","griseus","Risso's dolphin",,,"N",,"08/11/2003",2003,8,11,,,,,,"MEXICO",26.266666,1,"Minute",-119.816666,1,"Minute",1,"North Pacific","U",,1/12/2004 0:00:00,,"A-1 S(DMSO),I-1 S(1ST IN LIQ.NITROGEN THEN FRZN -80), 1 M(BLUBBER FRZN -80).  use restriction changed to NO in 2020 due to Ballance retirement; contact E. Archer if questions",5/31/2012 16:08:23,"dan.prosperi",4/10/2024 10:11:22
37972,,,"DSJ030811.05",203248,,"2003-STAR-DSJ",,,,,,"BIOPSY (PROJECTILE)",603,"LISA Ballance",1,"SWFSC",,,"Southwest Fisheries Science Center, National Marine Fisheries Service, La Jolla, CA",,"ARC",21,"021","C","CETACEA","G gri","Grampus","griseus","Risso's dolphin",,,"N",,"08/11/2003",2003,8,11,,,,,,"MEXICO",26.216666,1,"Minute",-119.816666,1,"Minute",1,"North Pacific","U",,1/12/2004 0:00:00,,"BLUBBER WENT INTO DMSO FIRST,A-1 S(DMSO),I-1 S(1ST LIQ.NIT.FRZN -80),1M-80.  use restriction changed to NO in 2020 due to Ballance retirement; contact E. Archer if questions",5/31/2012 16:08:23,"dan.prosperi",4/10/2024 10:11:22
38113,,,"DSJ030906.11",203389,,"2003-STAR-DSJ",,,,,,"BIOPSY (PROJECTILE)",603,"LISA Ballance",1,"SWFSC",,,"Southwest Fisheries Science Center, National Marine Fisheries Service, La Jolla, CA",,"ARC",21,"021","C","CETACEA","G gri","Grampus","griseus","Risso's dolphin",,,"N",,"09/06/2003",2003,9,6,,,,,,"MEXICO",17.1,1,"Minute",-100.966666,1,"Minute",1,"North Pacific","U",,1/12/2004 0:00:00,,"A-1 S(DMSO),I-1 S(1ST IN LIQ.NITROGEN THEN FRZN -80), 1 M(BLUBBER FRZN -80).  use restriction changed to NO in 2020 due to Ballance retirement; contact E. Archer if questions",5/31/2012 16:08:26,"dan.prosperi",4/10/2024 10:11:22
38114,,,"DSJ030906.12",203390,,"2003-STAR-DSJ",,,,,,"BIOPSY (PROJECTILE)",603,"LISA Ballance",1,"SWFSC",,,"Southwest Fisheries Science Center, National Marine Fisheries Service, La Jolla, CA",,"ARC",21,"021","C","CETACEA","G gri","Grampus","griseus","Risso's dolphin",,,"N",,"09/06/2003",2003,9,6,,,,,,"MEXICO",17.1,1,"Minute",-100.966666,1,"Minute",1,"North Pacific","U",,1/12/2004 0:00:00,,"A-1 S(DMSO),I-1 S(1ST IN LIQ.NITROGEN THEN FRZN -80), 1 M(BLUBBER FRZN -80).  use restriction changed to NO in 2020 due to Ballance retirement; contact E. Archer if questions",5/31/2012 16:08:26,"dan.prosperi",4/10/2024 10:11:22
38251,,,"DSJ031029.21",203527,,"2003-STAR-DSJ",,,,,,"BIOPSY (PROJECTILE)",603,"LISA Ballance",1,"SWFSC",,,"Southwest Fisheries Science Center, National Marine Fisheries Service, La Jolla, CA",,"ARC",21,"021","C","CETACEA","G gri","Grampus","griseus","Risso's dolphin",,,"N",,"10/29/2003",2003,10,29,,,,,,"MEXICO",15.15,1,"Minute",-94.05,1,"Minute",1,"North Pacific","U",,1/12/2004 0:00:00,,"A-1 S(DMSO),I-1 S(1ST IN LIQ.NITROGEN THEN FRZN -80), 1 M(BLUBBER FRZN -80).  use restriction changed to NO in 2020 due to Ballance retirement; contact E. Archer if questions",5/31/2012 16:08:28,"dan.prosperi",4/10/2024 10:11:22
38252,,,"DSJ031029.22",203528,,"2003-STAR-DSJ",,,,,,"BIOPSY (PROJECTILE)",603,"LISA Ballance",1,"SWFSC",,,"Southwest Fisheries Science Center, National Marine Fisheries Service, La Jolla, CA",,"ARC",21,"021","C","CETACEA","G gri","Grampus","griseus","Risso's dolphin",,,"N",,"10/29/2003",2003,10,29,,,,,,"MEXICO",15.15,1,"Minute",-94.05,1,"Minute",1,"North Pacific","U",,1/12/2004 0:00:00,,"A-1 S(DMSO),I-1 S(1ST IN LIQ.NITROGEN THEN FRZN -80), 1 M(BLUBBER FRZN -80).  use restriction changed to NO in 2020 due to Ballance retirement; contact E. Archer if questions",5/31/2012 16:08:28,"dan.prosperi",4/10/2024 10:11:22
38253,,,"DSJ031029.23",203529,,"2003-STAR-DSJ",,,,,,"BIOPSY (PROJECTILE)",603,"LISA Ballance",1,"SWFSC",,,"Southwest Fisheries Science Center, National Marine Fisheries Service, La Jolla, CA",,"ARC",21,"021","C","CETACEA","G gri","Grampus","griseus","Risso's dolphin",,,"N",,"10/29/2003",2003,10,29,,,,,,"MEXICO",15.15,1,"Minute",-94.05,1,"Minute",1,"North Pacific","U",,1/12/2004 0:00:00,,"A-1 S(DMSO),I-1 S(1ST IN LIQ.NITROGEN THEN FRZN -80), 1 M(BLUBBER FRZN -80).  use restriction changed to NO in 2020 due to Ballance retirement; contact E. Archer if questions",5/31/2012 16:08:28,"dan.prosperi",4/10/2024 10:11:22
38254,,,"DSJ031029.24",203530,,"2003-STAR-DSJ",,,,,,"BIOPSY (PROJECTILE)",603,"LISA Ballance",1,"SWFSC",,,"Southwest Fisheries Science Center, National Marine Fisheries Service, La Jolla, CA",,"ARC",21,"021","C","CETACEA","G gri","Grampus","griseus","Risso's dolphin",,,"N",,"10/29/2003",2003,10,29,,,,,,"MEXICO",15.183333,1,"Minute",-94.216666,1,"Minute",1,"North Pacific","U",,1/12/2004 0:00:00,,"A-1 S(DMSO),I-1 S(1ST IN LIQ.NITROGEN THEN FRZN -80), 1 M(BLUBBER FRZN -80).  use restriction changed to NO in 2020 due to Ballance retirement; contact E. Archer if questions",5/31/2012 16:08:28,"dan.prosperi",4/10/2024 10:11:22
38255,,,"DSJ031029.25",203531,,"2003-STAR-DSJ",,,,,,"BIOPSY (PROJECTILE)",603,"LISA Ballance",1,"SWFSC",,,"Southwest Fisheries Science Center, National Marine Fisheries Service, La Jolla, CA",,"ARC",21,"021","C","CETACEA","G gri","Grampus","griseus","Risso's dolphin",,,"N",,"10/29/2003",2003,10,29,,,,,,"MEXICO",15.183333,1,"Minute",-94.216666,1,"Minute",1,"North Pacific","U",,1/12/2004 0:00:00,,"A-1 S(DMSO),I-1 S(1ST IN LIQ.NITROGEN THEN FRZN -80), 1 M(BLUBBER FRZN -80).  use restriction changed to NO in 2020 due to Ballance retirement; contact E. Archer if questions",5/31/2012 16:08:28,"dan.prosperi",4/10/2024 10:11:22
38256,,,"DSJ031029.26",203532,,"2003-STAR-DSJ",,,,,,"BIOPSY (PROJECTILE)",603,"LISA Ballance",1,"SWFSC",,,"Southwest Fisheries Science Center, National Marine Fisheries Service, La Jolla, CA",,"ARC",21,"021","C","CETACEA","G gri","Grampus","griseus","Risso's dolphin",,,"N",,"10/29/2003",2003,10,29,,,,,,"MEXICO",15.183333,1,"Minute",-94.216666,1,"Minute",1,"North Pacific","U",,1/12/2004 0:00:00,,"A-1 S(DMSO),I-1 S(1ST IN LIQ.NITROGEN THEN FRZN -80), 1 M(BLUBBER FRZN -80).  use restriction changed to NO in 2020 due to Ballance retirement; contact E. Archer if questions",5/31/2012 16:08:28,"dan.prosperi",4/10/2024 10:11:22
38257,,,"DSJ031029.27",203533,,"2003-STAR-DSJ",,,,,,"BIOPSY (PROJECTILE)",603,"LISA Ballance",1,"SWFSC",,,"Southwest Fisheries Science Center, National Marine Fisheries Service, La Jolla, CA",,"ARC",21,"021","C","CETACEA","G gri","Grampus","griseus","Risso's dolphin",,,"N",,"10/29/2003",2003,10,29,,,,,,"MEXICO",15.183333,1,"Minute",-94.216666,1,"Minute",1,"North Pacific","U",,1/12/2004 0:00:00,,"A-1 S(DMSO),I-1 S(1ST IN LIQ.NITROGEN THEN FRZN -80), 1 M(BLUBBER FRZN -80).  use restriction changed to NO in 2020 due to Ballance retirement; contact E. Archer if questions",5/31/2012 16:08:28,"dan.prosperi",4/10/2024 10:11:22
38258,,,"DSJ031029.28",203534,,"2003-STAR-DSJ",,,,,,"BIOPSY (PROJECTILE)",603,"LISA Ballance",1,"SWFSC",,,"Southwest Fisheries Science Center, National Marine Fisheries Service, La Jolla, CA",,"ARC",21,"021","C","CETACEA","G gri","Grampus","griseus","Risso's dolphin",,,"N",,"10/29/2003",2003,10,29,,,,,,"MEXICO",15.183333,1,"Minute",-94.216666,1,"Minute",1,"North Pacific","U",,1/12/2004 0:00:00,,"A-1 S(DMSO),I-1 S(1ST IN LIQ.NITROGEN THEN FRZN -80), 1 M(BLUBBER FRZN -80).  use restriction changed to NO in 2020 due to Ballance retirement; contact E. Archer if questions",5/31/2012 16:08:28,"dan.prosperi",4/10/2024 10:11:22
38266,,,"DSJ031030.08",203542,,"2003-STAR-DSJ",,,,,,"BIOPSY (PROJECTILE)",603,"LISA Ballance",1,"SWFSC",,,"Southwest Fisheries Science Center, National Marine Fisheries Service, La Jolla, CA",,"ARC",21,"021","C","CETACEA","G gri","Grampus","griseus","Risso's dolphin",,,"N",,"10/30/2003",2003,10,30,,,,,,"MEXICO",15.583333,1,"Minute",-95.883333,1,"Minute",1,"North Pacific","U",,1/12/2004 0:00:00,,"A-1 S(DMSO),I-1 S(1ST IN LIQ.NITROGEN THEN FRZN -80), 1 M(BLUBBER FRZN -80).  use restriction changed to NO in 2020 due to Ballance retirement; contact E. Archer if questions",5/31/2012 16:08:28,"dan.prosperi",4/10/2024 10:11:22
38275,,,"DSJ031101.02",203551,,"2003-STAR-DSJ",,,,,,"BIOPSY (PROJECTILE)",603,"LISA Ballance",1,"SWFSC",,,"Southwest Fisheries Science Center, National Marine Fisheries Service, La Jolla, CA",,"ARC",21,"021","C","CETACEA","G gri","Grampus","griseus","Risso's dolphin",,,"N",,"11/01/2003",2003,11,1,,,,,,"MEXICO",15.266666,1,"Minute",-100.8,1,"Minute",1,"North Pacific","U",,1/12/2004 0:00:00,,"A-1 S(DMSO),I-1 S(1ST IN LIQ.NITROGEN THEN FRZN -80).  use restriction changed to NO in 2020 due to Ballance retirement; contact E. Archer if questions",5/31/2012 16:08:29,"dan.prosperi",4/10/2024 10:11:22
38276,,,"DSJ031101.03",203552,,"2003-STAR-DSJ",,,,,,"BIOPSY (PROJECTILE)",603,"LISA Ballance",1,"SWFSC",,,"Southwest Fisheries Science Center, National Marine Fisheries Service, La Jolla, CA",,"ARC",21,"021","C","CETACEA","G gri","Grampus","griseus","Risso's dolphin",,,"N",,"11/01/2003",2003,11,1,,,,,,"MEXICO",15.266666,1,"Minute",-100.8,1,"Minute",1,"North Pacific","U",,1/12/2004 0:00:00,,"A-1 S(DMSO).  use restriction changed to NO in 2020 due to Ballance retirement; contact E. Archer if questions",5/31/2012 16:08:29,"dan.prosperi",4/10/2024 10:11:22
38277,,,"DSJ031101.04",203553,,"2003-STAR-DSJ",,,,,,"BIOPSY (PROJECTILE)",603,"LISA Ballance",1,"SWFSC",,,"Southwest Fisheries Science Center, National Marine Fisheries Service, La Jolla, CA",,"ARC",21,"021","C","CETACEA","G gri","Grampus","griseus","Risso's dolphin",,,"N",,"11/01/2003",2003,11,1,,,,,,"MEXICO",15.266666,1,"Minute",-100.8,1,"Minute",1,"North Pacific","U",,1/12/2004 0:00:00,,"A-1 S(DMSO),I-1 S(1ST IN LIQ.NITROGEN THEN FRZN -80), 1 M(BLUBBER FRZN -80).  use restriction changed to NO in 2020 due to Ballance retirement; contact E. Archer if questions",5/31/2012 16:08:29,"dan.prosperi",4/10/2024 10:11:22
39080,,"CAGN","BXD0010",203828,,,,,,,,"BYCATCH",385,"Kerri Danil",459,"NMFS, SWR, OBSERVER PROGRAM",,,"NMFS, SOUTHWEST REGION FISHERY OBSERVER PROGRAM and SOUTHWEST FISHERIES SCIENCE CENTER",,"SJC",21,"021","C","CETACEA","G gri","Grampus","griseus","Risso's dolphin",,,"N",,"11/16/2003",2003,11,16,"OFFSHORE",,,,"CALIFORNIA","UNITED STATES OF AMERICA",35.966666,1,"Minute",-121.933333,1,"Minute",1,"North Pacific","M","Molecular determination: SRY method",3/25/2004 0:00:00,,"SPECIES ID: MACMATCH, 98%",5/31/2012 16:08:42,"dan.prosperi",6/17/2022 15:50:07
39082,,"CAGN","BXD0012",203830,,,,,,,,"BYCATCH",385,"Kerri Danil",459,"NMFS, SWR, OBSERVER PROGRAM",,,"NMFS, SOUTHWEST REGION FISHERY OBSERVER PROGRAM and SOUTHWEST FISHERIES SCIENCE CENTER",,"SJC",21,"021","C","CETACEA","G gri","Grampus","griseus","Risso's dolphin",,,"N",,"11/16/2003",2003,11,16,"OFFSHORE",,,,"CALIFORNIA","UNITED STATES OF AMERICA",35.966666,1,"Minute",-121.933333,1,"Minute",1,"North Pacific","M","Field determination: gonads were examined; carcass was examined and dissected.",3/25/2004 0:00:00,,"SPECIES ID: MACMATCH, 98%",5/31/2012 16:08:42,"dan.prosperi",6/17/2022 15:50:07
39083,,"CAGN","BXD0013",203831,,,,,,,,"BYCATCH",385,"Kerri Danil",459,"NMFS, SWR, OBSERVER PROGRAM",,,"NMFS, SOUTHWEST REGION FISHERY OBSERVER PROGRAM and SOUTHWEST FISHERIES SCIENCE CENTER",,"SJC",21,"021","C","CETACEA","G gri","Grampus","griseus","Risso's dolphin",,,"N",,"11/16/2003",2003,11,16,"OFFSHORE",,,,"CALIFORNIA","UNITED STATES OF AMERICA",35.966666,1,"Minute",-121.933333,1,"Minute",1,"North Pacific","F","Field determination: external exam only; live animal or carcass was examined but not dissected.",3/25/2004 0:00:00,,"GENDER CONFIRMED BY SRY, SPECIES ID: MACMATCH, 98%, LOAN 160",5/31/2012 16:08:42,"dan.prosperi",6/17/2022 15:50:07
39084,,"CAGN","BXD0014",203832,,,,,,,,"BYCATCH",385,"Kerri Danil",459,"NMFS, SWR, OBSERVER PROGRAM",,,"NMFS, SOUTHWEST REGION FISHERY OBSERVER PROGRAM and SOUTHWEST FISHERIES SCIENCE CENTER",,"SJC",21,"021","C","CETACEA","G gri","Grampus","griseus","Risso's dolphin",,,"N",,"11/16/2003",2003,11,16,"OFFSHORE",,,,"CALIFORNIA","UNITED STATES OF AMERICA",35.966666,1,"Minute",-121.933333,1,"Minute",1,"North Pacific","M","Field determination: external exam only; live animal or carcass was examined but not dissected.",3/25/2004 0:00:00,,"SPECIES ID: MACMATCH, 96%",5/31/2012 16:08:42,"dan.prosperi",6/17/2022 15:50:07
39556,,,"SBMNH2003-38",204304,,,,,,,,"STRANDING",350,"Michelle Berman",10,"Santa Barbara Museum of Natural History",,,"YES, AND NOTIFY OF USE",,"SJC",21,"021","C","CETACEA","G gri","Grampus","griseus","Risso's dolphin",,,"N",,"05/30/2003",2003,5,30,"OXNARD SHORES AT 5TH ST.",,,"Ventura","CALIFORNIA","UNITED STATES OF AMERICA",34,1,"Minute",-119,1,"Minute",1,"North Pacific","F","Field determination: gonads were examined; carcass was examined and dissected.",4/6/2004 0:00:00,,"LTH=143.5CM, WT.73LB..  Sample use not restricted, but would like to be acknowledeged.",5/31/2012 16:08:50,"dan.prosperi",6/23/2022 14:04:57
41842,,,"GG#1/9-15-04",205799,,,,,,,,"BIOPSY (PROJECTILE)",718,"TOM JEFFERSON",264,"CLYMENE ENTERPRISES",,,"YES",,"TAJ",21,"021","C","CETACEA","G gri","Grampus","griseus","Risso's dolphin",,,"N",,"09/15/2004",2004,9,15,,,,"Monterey","CALIFORNIA","UNITED STATES OF AMERICA",36.783333,1,"Minute",-121.983333,1,"Minute",1,"North Pacific","U",,10/12/2004 0:00:00,,"ADULT.  Source was recorded as ""BIOPSY-SWFSC-JEFFERSON""",5/31/2012 16:09:28,"dan.prosperi",6/23/2022 10:42:28
41843,,,"GG#2/9-15-04",205800,,,,,,,,"BIOPSY (PROJECTILE)",718,"TOM JEFFERSON",264,"CLYMENE ENTERPRISES",,,"YES",,"TAJ",21,"021","C","CETACEA","G gri","Grampus","griseus","Risso's dolphin",,,"N",,"09/15/2004",2004,9,15,,,,"Monterey","CALIFORNIA","UNITED STATES OF AMERICA",36.8,1,"Minute",-122,1,"Minute",1,"North Pacific","U",,10/12/2004 0:00:00,,"ADULT.  Source was recorded as ""BIOPSY-SWFSC-JEFFERSON""",5/31/2012 16:09:28,"dan.prosperi",6/23/2022 10:42:28
41844,,,"GG#3/9-15-04",205801,,,,,,,,"BIOPSY (PROJECTILE)",718,"TOM JEFFERSON",264,"CLYMENE ENTERPRISES",,,"YES",,"TAJ",21,"021","C","CETACEA","G gri","Grampus","griseus","Risso's dolphin",,,"N",,"09/15/2004",2004,9,15,,,,"Monterey","CALIFORNIA","UNITED STATES OF AMERICA",36.8,1,"Minute",-122,1,"Minute",1,"North Pacific","U",,10/12/2004 0:00:00,,"ADULT.  Source was recorded as ""BIOPSY-SWFSC-JEFFERSON""",5/31/2012 16:09:28,"dan.prosperi",6/23/2022 10:42:28
41845,,,"GG#4/9-15-04",205802,,,,,,,,"BIOPSY (PROJECTILE)",718,"TOM JEFFERSON",264,"CLYMENE ENTERPRISES",,,"YES",,"TAJ",21,"021","C","CETACEA","G gri","Grampus","griseus","Risso's dolphin",,,"N",,"09/15/2004",2004,9,15,,,,"Monterey","CALIFORNIA","UNITED STATES OF AMERICA",36.8,1,"Minute",-121.983333,1,"Minute",1,"North Pacific","U",,10/12/2004 0:00:00,,"ADULT.  Source was recorded as ""BIOPSY-SWFSC-JEFFERSON""",5/31/2012 16:09:28,"dan.prosperi",6/23/2022 10:42:28
41846,,,"GG#5/9-15-04",205803,,,,,,,,"BIOPSY (PROJECTILE)",718,"TOM JEFFERSON",264,"CLYMENE ENTERPRISES",,,"YES",,"TAJ",21,"021","C","CETACEA","G gri","Grampus","griseus","Risso's dolphin",,,"N",,"09/15/2004",2004,9,15,,,,"Monterey","CALIFORNIA","UNITED STATES OF AMERICA",36.8,1,"Minute",-121.983333,1,"Minute",1,"North Pacific","U",,10/12/2004 0:00:00,,"ADULT.  Source was recorded as ""BIOPSY-SWFSC-JEFFERSON""",5/31/2012 16:09:28,"dan.prosperi",6/23/2022 10:42:28
41847,,,"GG#6/9-15-04",205804,,,,,,,,"BIOPSY (PROJECTILE)",718,"TOM JEFFERSON",264,"CLYMENE ENTERPRISES",,,"YES",,"TAJ",21,"021","C","CETACEA","G gri","Grampus","griseus","Risso's dolphin",,,"N",,"09/15/2004",2004,9,15,,,,"Monterey","CALIFORNIA","UNITED STATES OF AMERICA",36.8,1,"Minute",-121.983333,1,"Minute",1,"North Pacific","U",,10/12/2004 0:00:00,,"ADULT.  Source was recorded as ""BIOPSY-SWFSC-JEFFERSON""",5/31/2012 16:09:28,"dan.prosperi",6/23/2022 10:42:28
41850,,,"GG#1/9-18-04",205807,,,,,,,,"BIOPSY (PROJECTILE)",718,"TOM JEFFERSON",264,"CLYMENE ENTERPRISES",,,"YES",,"TAJ",21,"021","C","CETACEA","G gri","Grampus","griseus","Risso's dolphin",,,"N",,"09/18/2004",2004,9,18,,,,"Monterey","CALIFORNIA","UNITED STATES OF AMERICA",36.766666,1,"Minute",-122.133333,1,"Minute",1,"North Pacific","U",,10/12/2004 0:00:00,,"ADULT, SUBSAMPLE FOR ZOO.  Source was recorded as ""BIOPSY-SWFSC-JEFFERSON""",5/31/2012 16:09:28,"dan.prosperi",6/23/2022 10:42:28
48062,,,"NEPST173",209349,,,,,,,,"STRANDING",419,"ANTONIO MIGNUCCI-GIANNONI",307,"CARIBBEAN STRANDING NETWORK, UNIVERSIDAD METROPOLITANA",,,,,"KMR",21,"021","C","CETACEA","G gri","Grampus","griseus","Risso's dolphin",,,"Y","Donator requested that PI request permission to use in study","10/16/1991",1991,10,16,,,"Isla de Vieques",,,"PUERTO RICO",18.15,1,"Minute",-65.45,1,"Minute",2,"North Atlantic","M","Field determination: gonads were examined; carcass was examined and dissected.",8/18/2005 0:00:00,,,5/31/2012 16:11:09,"dan.prosperi",6/23/2022 12:38:22
48081,,,"NEPST512",209368,,,,,,,,"STRANDING",419,"ANTONIO MIGNUCCI-GIANNONI",307,"CARIBBEAN STRANDING NETWORK, UNIVERSIDAD METROPOLITANA",,,,,"KMR",21,"021","C","CETACEA","G gri","Grampus","griseus","Risso's dolphin",,,"Y","Donator requested that PI request permission to use in study","06/10/1996",1996,6,10,"GUAYANILLA",,,,,"PUERTO RICO",17.966666,1,"Minute",-66.766666,1,"Minute",2,"North Atlantic","M","Field determination: gonads were examined; carcass was examined and dissected.",8/18/2005 0:00:00,,,5/31/2012 16:11:10,"dan.prosperi",6/23/2022 12:38:22
48084,,,"NEPST533",209371,,,,,,,,"STRANDING",419,"ANTONIO MIGNUCCI-GIANNONI",307,"CARIBBEAN STRANDING NETWORK, UNIVERSIDAD METROPOLITANA",,,,,"KMR",21,"021","C","CETACEA","G gri","Grampus","griseus","Risso's dolphin",,,"Y","Donator requested that PI request permission to use in study","01/28/1998",1998,1,28,"VEGA BAJA",,,,,"PUERTO RICO",18.483333,1,"Minute",-66.366666,1,"Minute",2,"North Atlantic","M","Field determination: gonads were examined; carcass was examined and dissected.",8/18/2005 0:00:00,,,5/31/2012 16:11:10,"dan.prosperi",6/23/2022 12:38:22
48586,,,"HYDE050814.01",209694,,,,,,,,"BIOPSY (PROJECTILE)",552,"JOHN HYDE",1,"SWFSC",,,"J. Hyde, Southwest Fisheries Science Center, National Marine Fisheries Service, La Jolla, CA",,"JRH",21,"021","C","CETACEA","G gri","Grampus","griseus","Risso's dolphin",,,"N",,"08/14/2005",2005,8,14,"LA JOLLA, OFFSHORE",,,"San Diego","CALIFORNIA","UNITED STATES OF AMERICA",32.6,1,"Minute",-117.383333,1,"Minute",1,"North Pacific","U",,9/5/2005 0:00:00,,,5/31/2012 16:11:18,"dan.prosperi",6/10/2022 15:06:32
51127,,,"DSJ050817.01",210475,,"2005-CSCAPE-DSJ",,,,,,"BIOPSY (PROJECTILE)",571,"KARIN FORNEY",1,"SWFSC",,,"Southwest Fisheries Science Center, National Marine Fisheries Service, La Jolla, CA",,"KAF",21,"021","C","CETACEA","G gri","Grampus","griseus","Risso's dolphin",,,"Y","No external permission needed, but donator requests notification when used.","08/17/2005",2005,8,17,"WEST COAST",,,,,"UNITED STATES OF AMERICA",44.983333,1,"Minute",-124.383333,1,"Minute",1,"North Pacific","U",,1/11/2006 0:00:00,,"When Contact 571 is no longer available, permissions to permanently revert to Contact 394.",5/31/2012 16:12:02,"dan.prosperi",4/10/2024 10:11:22
51128,,,"DSJ050817.02",210476,,"2005-CSCAPE-DSJ",,,,,,"BIOPSY (PROJECTILE)",571,"KARIN FORNEY",1,"SWFSC",,,"Southwest Fisheries Science Center, National Marine Fisheries Service, La Jolla, CA",,"KAF",21,"021","C","CETACEA","G gri","Grampus","griseus","Risso's dolphin",,,"Y","No external permission needed, but donator requests notification when used.","08/17/2005",2005,8,17,"WEST COAST",,,,,"UNITED STATES OF AMERICA",44.983333,1,"Minute",-124.383333,1,"Minute",1,"North Pacific","U",,1/11/2006 0:00:00,,"When Contact 571 is no longer available, permissions to permanently revert to Contact 394.",5/31/2012 16:12:03,"dan.prosperi",4/10/2024 10:11:22
51129,,,"DSJ050817.03",210477,,"2005-CSCAPE-DSJ",,,,,,"BIOPSY (PROJECTILE)",571,"KARIN FORNEY",1,"SWFSC",,,"Southwest Fisheries Science Center, National Marine Fisheries Service, La Jolla, CA",,"KAF",21,"021","C","CETACEA","G gri","Grampus","griseus","Risso's dolphin",,,"Y","No external permission needed, but donator requests notification when used.","08/17/2005",2005,8,17,"WEST COAST",,,,,"UNITED STATES OF AMERICA",44.983333,1,"Minute",-124.383333,1,"Minute",1,"North Pacific","U",,1/11/2006 0:00:00,,"When Contact 571 is no longer available, permissions to permanently revert to Contact 394.",5/31/2012 16:12:03,"dan.prosperi",4/10/2024 10:11:22
51130,,,"DSJ050817.04",210478,,"2005-CSCAPE-DSJ",,,,,,"BIOPSY (PROJECTILE)",571,"KARIN FORNEY",1,"SWFSC",,,"Southwest Fisheries Science Center, National Marine Fisheries Service, La Jolla, CA",,"KAF",21,"021","C","CETACEA","G gri","Grampus","griseus","Risso's dolphin",,,"Y","No external permission needed, but donator requests notification when used.","08/17/2005",2005,8,17,"WEST COAST",,,,,"UNITED STATES OF AMERICA",44.983333,1,"Minute",-124.383333,1,"Minute",1,"North Pacific","U",,1/11/2006 0:00:00,,"When Contact 571 is no longer available, permissions to permanently revert to Contact 394.",5/31/2012 16:12:03,"dan.prosperi",4/10/2024 10:11:22
52455,,,"HYDE060123.01",211573,,,,,,,,"BIOPSY (PROJECTILE)",552,"JOHN HYDE",1,"SWFSC",,,"J. Hyde, Southwest Fisheries Science Center, National Marine Fisheries Service, La Jolla, CA",,"JRH",21,"021","C","CETACEA","G gri","Grampus","griseus","Risso's dolphin",,,"N",,"01/23/2006",2006,1,23,"LA JOLLA, BLACKS BEACH, INSHORE",,,"San Diego","CALIFORNIA","UNITED STATES OF AMERICA",32.95,1,"Minute",-117.366666,1,"Minute",1,"North Pacific","U",,2/1/2006 0:00:00,,,5/31/2012 16:12:24,"dan.prosperi",6/10/2022 15:06:32
52456,,,"HYDE060123.02",211574,,,,,,,,"BIOPSY (PROJECTILE)",552,"JOHN HYDE",1,"SWFSC",,,"J. Hyde, Southwest Fisheries Science Center, National Marine Fisheries Service, La Jolla, CA",,"JRH",21,"021","C","CETACEA","G gri","Grampus","griseus","Risso's dolphin",,,"N",,"01/23/2006",2006,1,23,"LA JOLLA, BLACKS BEACH, INSHORE",,,"San Diego","CALIFORNIA","UNITED STATES OF AMERICA",32.95,1,"Minute",-117.366666,1,"Minute",1,"North Pacific","U",,2/1/2006 0:00:00,,,5/31/2012 16:12:24,"dan.prosperi",6/10/2022 15:06:32
53165,,,"SBMNH2004-24",212224,,,,,,,,"STRANDING",350,"Michelle Berman",10,"Santa Barbara Museum of Natural History",,,"YES, AND NOTIFY OF USE",,"SJC",21,"021","C","CETACEA","G gri","Grampus","griseus","Risso's dolphin",,,"N",,"10/11/2004",2004,10,11,"LOMPOC, OCEAN PARK BEACH",,,"Santa Barbara","CALIFORNIA","UNITED STATES OF AMERICA",34.683333,1,"Minute",-120.6,1,"Minute",1,"North Pacific","F","Field determination: gonads were examined; carcass was examined and dissected.",3/16/2006 0:00:00,,"Sample use not restricted, but would like to be acknowledeged.",5/31/2012 16:12:35,"dan.prosperi",6/23/2022 14:04:57
53476,,"HI-LONGLINE","LL2012",212288,,,,,,,,"BYCATCH",530,"JAMIE MARCHETTI",456,"NMFS, PACIFIC ISLANDS REGIONAL OFFICE, OBSERVER PROGRAM",,,"Pacific Islands Regional Office Observer Program",,"SJC",21,"021","C","CETACEA","G gri","Grampus","griseus","Risso's dolphin",,,"Y","No external permission needed, but donator requests notification when used.","01/17/2006",2006,1,17,"NORTH OF THE ISLANDS",,,,"HAWAII","UNITED STATES OF AMERICA",32.316666,1,"Minute",-157.366666,1,"Minute",1,"North Pacific","U",,3/27/2006 0:00:00,,"SPECIES ID CONFIRMED BY MACMATCH 98% MATCH.  No use restrictions, but would like to be notified of use and purpose - sample use is monitored by the Collections Curator and Manager.",5/31/2012 16:12:40,"Alaina.Harmon",4/26/2023 11:38:59
57814,,,"MLMLMM1174",214408,,,,,,,,"STRANDING",543,"JIM HARVEY",7,"Moss Landing Marine Laboratories",,,"Moss Landing Marine Laboratories, CA Stranding Network Participants",,"SJC",21,"021","C","CETACEA","G gri","Grampus","griseus","Risso's dolphin",,,"N",,"01/31/2005",2005,1,31,"Monterey, Pebble Beach, in front of Seal Rock",,,,"CALIFORNIA","UNITED STATES OF AMERICA",36.583333,1,"Minute",-121.95,1,"Minute",1,"North Pacific","M","Field determination: gonads were examined; carcass was examined and dissected.",9/6/2006 0:00:00,,"Additional Contact:  P.O. BOX 450, TIFFINI BROOKENS-TJBROOKEN@AOL.COM",5/31/2012 16:13:51,"dan.prosperi",6/21/2022 9:17:40
61944,,,"CRC20060730-02",215055,,,,,,,,"BIOPSY (PROJECTILE)",550,"JOHN CALAMBOKIDIS",255,"CASCADIA RESEARCH COLLECTIVE",,,"contact J. Calambokidis",,"KMR",21,"021","C","CETACEA","G gri","Grampus","griseus","Risso's dolphin",,,"Y","Donator requested that PI request permission to use in study","07/30/2006",2006,7,30,,,,,"WASHINGTON","UNITED STATES OF AMERICA",47.3,1,"Minute",-124.75,1,"Minute",1,"North Pacific","U",,2/2/2007 0:00:00,,"TODD CHANDLER:510-414-3138",5/31/2012 16:15:00,"dan.prosperi",6/8/2022 7:21:53
61945,,,"CRC20060730-03",215056,,,,,,,,"BIOPSY (PROJECTILE)",550,"JOHN CALAMBOKIDIS",255,"CASCADIA RESEARCH COLLECTIVE",,,"contact J. Calambokidis",,"KMR",21,"021","C","CETACEA","G gri","Grampus","griseus","Risso's dolphin",,,"Y","Donator requested that PI request permission to use in study","07/30/2006",2006,7,30,,,,,"WASHINGTON","UNITED STATES OF AMERICA",47.3,1,"Minute",-124.75,1,"Minute",1,"North Pacific","U",,2/2/2007 0:00:00,,"TODD CHANDLER:510-414-3138",5/31/2012 16:15:00,"dan.prosperi",6/8/2022 7:21:53
61948,,,"CRC20060811-01",215059,,,,,,,,"BIOPSY (PROJECTILE)",550,"JOHN CALAMBOKIDIS",255,"CASCADIA RESEARCH COLLECTIVE",,,"contact J. Calambokidis",,"KMR",21,"021","C","CETACEA","G gri","Grampus","griseus","Risso's dolphin",,,"Y","Donator requested that PI request permission to use in study","08/11/2006",2006,8,11,,,,,"CALIFORNIA","UNITED STATES OF AMERICA",33.183333,1,"Minute",-118.233333,1,"Minute",1,"North Pacific","U",,2/2/2007 0:00:00,,"TODD CHANDLER:510-414-3138",5/31/2012 16:15:00,"dan.prosperi",6/8/2022 7:21:53
62830,,"HI-LONGLINE","LL2374",215485,,,,,,,,"BYCATCH",530,"JAMIE MARCHETTI",456,"NMFS, PACIFIC ISLANDS REGIONAL OFFICE, OBSERVER PROGRAM",,,"Pacific Islands Regional Office Observer Program",,"SJC",21,"021","C","CETACEA","G gri","Grampus","griseus","Risso's dolphin",,,"Y","No external permission needed, but donator requests notification when used.","02/21/2007",2007,2,21,"NORTH OF THE ISLANDS",,,,"HAWAII","UNITED STATES OF AMERICA",30.983333,1,"Minute",-159.016666,1,"Minute",1,"North Pacific","U",,3/20/2007 0:00:00,,"96% MATCH IN MACMATCH, DNA SURV DISTANCE IS 0.0179..  No use restrictions, but would like to be notified of use and purpose - sample use is monitored by the Collections Curator and Manager.",5/31/2012 16:15:14,"Alaina.Harmon",4/26/2023 11:38:56
66557,,,"KXD0127",216768,,,,,,,,"STRANDING",398,"STRANDING COORDINATOR ",1,"SWFSC",,,"NMFS, Southwest Fisheries Science Center",,"K_D",21,"021","C","CETACEA","G gri","Grampus","griseus","Risso's dolphin",,,"N",,"06/25/2007",2007,6,25,"SAN CLEMENTE, TOWER 10",,,"Orange","CALIFORNIA","UNITED STATES OF AMERICA",33.416666,1,"Minute",-117.633333,1,"Minute",1,"North Pacific","F","Molecular determination: ZFX/ZFY 5' exonuclease qPCR assay developed at SWFSC.",7/6/2007 0:00:00,,,5/31/2012 16:16:16,"dan.prosperi",6/8/2022 7:21:53
73404,,,"C 220",219045,,,,,,,,"STRANDING",383,"Barbie Halaska",4,"The Marine Mammal Center",,,"The Marine Mammal Center, Sausalito, CA",,"ARC",21,"021","C","CETACEA","G gri","Grampus","griseus","Risso's dolphin",,,"N",,"11/25/2006",2006,11,25,"FANSHELL BEACH",,,"Monterey","CALIFORNIA","UNITED STATES OF AMERICA",,,,,,,1,"North Pacific","M","Field determination: external exam only; live animal or carcass was examined but not dissected.",2/27/2008 0:00:00,,,5/31/2012 16:18:09,"dan.prosperi",6/14/2022 10:00:08
73679,,"HI-LONGLINE","LL2670-120403",219118,,,,,,,,"BYCATCH",530,"JAMIE MARCHETTI",456,"NMFS, PACIFIC ISLANDS REGIONAL OFFICE, OBSERVER PROGRAM",,,"Pacific Islands Regional Office Observer Program",,"SJC",21,"021","C","CETACEA","G gri","Grampus","griseus","Risso's dolphin",,,"Y","No external permission needed, but donator requests notification when used.","12/24/2007",2007,12,24,"CENTRAL PACIFIC, SW OF HAWAIIAN ISLANDS",,,,"HAWAII","UNITED STATES OF AMERICA",18.183333,1,"Minute",-160.716666,1,"Minute",1,"North Pacific","U",,3/21/2008 0:00:00,,"SAMPLE ARRIVED IN DRY SALT, TRANSFERRED TO DMSO BY ARC..  No use restrictions, but would like to be notified of use and purpose - sample use is monitored by the Collections Curator and Manager.",5/31/2012 16:18:13,"Alaina.Harmon",4/26/2023 11:38:42
74703,,,"KXD0157",219522,,,,,,,,"STRANDING",398,"STRANDING COORDINATOR ",1,"SWFSC",,,"NMFS, Southwest Fisheries Science Center",,"K_D",21,"021","C","CETACEA","G gri","Grampus","griseus","Risso's dolphin",,,"N",,"08/08/2008",2008,8,8,"LEUCADIA, BEACON'S BEACH",,,"San Diego","CALIFORNIA","UNITED STATES OF AMERICA",,,,,,,1,"North Pacific","F","Field determination: gonads were examined; carcass was examined and dissected.",9/29/2008 0:00:00,,,5/31/2012 16:18:30,"dan.prosperi",6/8/2022 7:21:53
74706,,"HI-LONGLINE","LL2789-070115",219524,,,,,,,,"BYCATCH",530,"JAMIE MARCHETTI",456,"NMFS, PACIFIC ISLANDS REGIONAL OFFICE, OBSERVER PROGRAM",,,"Pacific Islands Regional Office Observer Program",,"SJC",21,"021","C","CETACEA","G gri","Grampus","griseus","Risso's dolphin",,,"Y","No external permission needed, but donator requests notification when used.","03/28/2008",2008,3,28,"NORTH OF HAWAIIAN ISLANDS",,,,"HAWAII","UNITED STATES OF AMERICA",30.166666,1,"Minute",-164.866666,1,"Minute",1,"North Pacific","U",,9/29/2008 0:00:00,,"SPECIES CONFIRMED MACMATCH 98%.  No use restrictions, but would like to be notified of use and purpose - sample use is monitored by the Collections Curator and Manager.",5/31/2012 16:18:30,"Alaina.Harmon",4/26/2023 11:38:43
76436,,,"SBMNH2008-06",220692,,,,,,,,"STRANDING",350,"Michelle Berman",10,"Santa Barbara Museum of Natural History",,,"YES, AND NOTIFY OF USE",,"ARC",21,"021","C","CETACEA","G gri","Grampus","griseus","Risso's dolphin",,,"N",,"03/30/2008",2008,3,30,"PT. MUGU",,,"Ventura","CALIFORNIA","UNITED STATES OF AMERICA",34.1,1,"Minute",-119.1,1,"Minute",1,"North Pacific","F","Field determination: external exam only; live animal or carcass was examined but not dissected.",12/5/2008 0:00:00,,"Sample use not restricted, but would like to be acknowledeged.",5/31/2012 16:18:59,"dan.prosperi",6/23/2022 14:04:57
76971,,,"MAC081130.04",220967,,"2008-ORCAWALE-MACII",,,,,,"BIOPSY (PROJECTILE)",534,"JAY BARLOW",1,"SWFSC",,,"Southwest Fisheries Science Center, National Marine Fisheries Service, La Jolla, CA",,"JPB",21,"021","C","CETACEA","G gri","Grampus","griseus","Risso's dolphin",,,"N",,"11/30/2008",2008,11,30,"WEST COAST",,,,,"UNITED STATES OF AMERICA",32.966666,1,"Minute",-118.016666,1,"Minute",1,"North Pacific","U",,12/15/2008 0:00:00,,"Alaina Harmon, 30 April 2024: Samples reverted to no external permission required following Jay Barlow's retirement.",5/31/2012 16:19:08,"Alaina.Harmon",4/30/2024 15:09:17
77617,,,"SWC-Gg-08122B",221050,,,,,,,,"STRANDING",371,"Eric Otjen",192,"Sea World - San Diego",,,,,"K_D",21,"021","C","CETACEA","G gri","Grampus","griseus","Risso's dolphin",,,"N",,"10/18/2008",2008,10,18,"LA JOLLA, 1/4 MI OFFSHORE WIND",,,"San Diego","CALIFORNIA","UNITED STATES OF AMERICA",32.833333,1,"Minute",-117.283333,1,"Minute",1,"North Pacific","M","Field determination: gonads were examined; carcass was examined and dissected.",2/13/2009 0:00:00,,"O=KIDNEY",5/31/2012 16:19:18,"Alaina.Harmon",11/20/2023 14:31:15
78761,,"HI-LONGLINE","LL3018",221889,,,,,,,,"BYCATCH",530,"JAMIE MARCHETTI",456,"NMFS, PACIFIC ISLANDS REGIONAL OFFICE, OBSERVER PROGRAM",,,"Pacific Islands Regional Office Observer Program",,"SJC",21,"021","C","CETACEA","G gri","Grampus","griseus","Risso's dolphin",,,"Y","No external permission needed, but donator requests notification when used.","11/10/2008",2008,11,10,"NORTH OF THE ISLANDS",,,,"HAWAII","UNITED STATES OF AMERICA",38.033333,1,"Minute",-146.366666,1,"Minute",1,"North Pacific","U",,6/30/2009 0:00:00,,"No use restrictions, but would like to be notified of use and purpose - sample use is monitored by the Collections Curator and Manager.",5/31/2012 16:19:36,"Alaina.Harmon",4/26/2023 11:38:36
79772,,,"CRC20090722-02",222085,,,,,,,,"BIOPSY (PROJECTILE)",550,"JOHN CALAMBOKIDIS",255,"CASCADIA RESEARCH COLLECTIVE",,,"contact J. Calambokidis",,"ARC",21,"021","C","CETACEA","G gri","Grampus","griseus","Risso's dolphin",,,"Y","Donator requested that PI request permission to use in study","07/22/2009",2009,7,22,"Dana Point-Long Beach-Catalina-SCI",,,,"CALIFORNIA","UNITED STATES OF AMERICA",32.566666,1,"Minute",-117.866666,1,"Minute",1,"North Pacific","U",,7/30/2009 0:00:00,,"TODD CHANDLER:510-414-3138",5/31/2012 16:19:55,"dan.prosperi",6/8/2022 7:21:53
79774,,,"CRC20090725-01",222087,,,,,,,,"BIOPSY (PROJECTILE)",550,"JOHN CALAMBOKIDIS",255,"CASCADIA RESEARCH COLLECTIVE",,,"contact J. Calambokidis",,"ARC",21,"021","C","CETACEA","G gri","Grampus","griseus","Risso's dolphin",,,"Y","Donator requested that PI request permission to use in study","07/25/2009",2009,7,25,,,"San Clemente Island",,"CALIFORNIA","UNITED STATES OF AMERICA",32.916666,1,"Minute",-118.933333,1,"Minute",1,"North Pacific","U",,7/30/2009 0:00:00,,"TODD CHANDLER:510-414-3138",5/31/2012 16:19:55,"dan.prosperi",6/8/2022 7:21:53
79779,,,"CRC20090726-04",222092,,,,,,,,"BIOPSY (PROJECTILE)",550,"JOHN CALAMBOKIDIS",255,"CASCADIA RESEARCH COLLECTIVE",,,"contact J. Calambokidis",,"ARC",21,"021","C","CETACEA","G gri","Grampus","griseus","Risso's dolphin",,,"Y","Donator requested that PI request permission to use in study","07/26/2009",2009,7,26,"DANA POINT",,"San Clemente Island",,"CALIFORNIA","UNITED STATES OF AMERICA",32.316666,1,"Minute",-118.05,1,"Minute",1,"North Pacific","U",,7/30/2009 0:00:00,,"Tiny piece of conective tissue on barb..  TODD CHANDLER:510-414-3138",5/31/2012 16:19:55,"dan.prosperi",6/8/2022 7:21:53
79937,,"CAGN","CYM0082",222250,,,,,,,,"BYCATCH",385,"Kerri Danil",459,"NMFS, SWR, OBSERVER PROGRAM",,,"NMFS, SOUTHWEST REGION FISHERY OBSERVER PROGRAM and SOUTHWEST FISHERIES SCIENCE CENTER",,"K_D",21,"021","C","CETACEA","G gri","Grampus","griseus","Risso's dolphin",,,"N",,"10/18/2008",2008,10,18,"OFFSHORE",,,,"CALIFORNIA","UNITED STATES OF AMERICA",34.7,1,"Minute",-121.05,1,"Minute",1,"North Pacific","M","Molecular determination: ZFX/ZFY 5' exonuclease qPCR assay developed at SWFSC.",8/4/2009 0:00:00,,"98% MATCH IN MACMATCH",5/31/2012 16:19:58,"dan.prosperi",6/17/2022 15:50:07
79953,,,"GCAMPBELL090723.01",222266,,,,,,,,"BIOPSY (PROJECTILE)",394,"Collection Manager - SWFSC ",,,"Greg Campbell",,,,"NMK",21,"021","C","CETACEA","G gri","Grampus","griseus","Risso's dolphin",,,"N",,"07/23/2009",2009,7,23,,,"San Clemente Island",,"CALIFORNIA","UNITED STATES OF AMERICA",33.066666,1,"Minute",-118.55,1,"Minute",1,"North Pacific","U",,8/5/2009 0:00:00,,"Greg Campbell (SCRIPPS INSTITUTION OF OCEANOGRAPHY, SCRIPPS WHALE ACOUSTIC LAB, 8635 Discovery Way, La Jolla, CA 92093, gscampbell@ucsd.edu) was the original collector and contact. Following his death, use restrictions removed April 2021 per Eric Archer.",5/31/2012 16:19:59,"dan.prosperi",6/24/2022 9:01:16
87478,,,"GGRI090819",222430,,,,,,,,"BIOPSY (PROJECTILE)",550,"JOHN CALAMBOKIDIS",255,"CASCADIA RESEARCH COLLECTIVE",,,"contact J. Calambokidis",,"RLP",21,"021","C","CETACEA","G gri","Grampus","griseus","Risso's dolphin",,,"N",,"08/19/2009",2009,8,19,"NW off Santa Catalina Island",,"Santa Catalina Island",,"CALIFORNIA","UNITED STATES OF AMERICA",,,,,,,1,"North Pacific","U",,9/14/2009 0:00:00,,"Sample collected by John Calambokidis and handed to SWFSC, changed to not use restricted per Pitman retirement.  TODD CHANDLER:510-414-3138",5/31/2012 16:22:01,"dan.prosperi",6/8/2022 7:21:53
87480,,,"GGRI090821",222432,,,,,,,,"BIOPSY (PROJECTILE)",670,"ROBERT PITMAN",1,"SWFSC",,,"Y",,"RLP",21,"021","C","CETACEA","G gri","Grampus","griseus","Risso's dolphin",,,"N",,"08/21/2009",2009,8,21,"NW off Santa Catalina Island",,"Santa Catalina Island",,"CALIFORNIA","UNITED STATES OF AMERICA",33.166666,1,"Minute",-118.716666,1,"Minute",1,"North Pacific","U",,9/14/2009 0:00:00,,"changed to not use restricted per Pitman retirement.  Pitman retains permission for Orcas, contact N. Kellar for all other species",5/31/2012 16:22:01,"dan.prosperi",6/10/2022 15:06:32
87483,,,"GGRI090823",222435,,,,,,,,"BIOPSY (PROJECTILE)",670,"ROBERT PITMAN",1,"SWFSC",,,"Y",,"RLP",21,"021","C","CETACEA","G gri","Grampus","griseus","Risso's dolphin",,,"N",,"08/23/2009",2009,8,23,"NW off Santa Catalina Island",,"Santa Catalina Island",,"CALIFORNIA","UNITED STATES OF AMERICA",33.483333,1,"Minute",-119.483333,1,"Minute",1,"North Pacific","U",,9/14/2009 0:00:00,,"changed to not use restricted per Pitman retirement.  Pitman retains permission for Orcas, contact N. Kellar for all other species",5/31/2012 16:22:01,"dan.prosperi",6/10/2022 15:06:32
88952,,,"CRC20091123-04",223089,,,,,,,,"BIOPSY (PROJECTILE)",550,"JOHN CALAMBOKIDIS",255,"CASCADIA RESEARCH COLLECTIVE",,,"contact J. Calambokidis",,"ARC",21,"021","C","CETACEA","G gri","Grampus","griseus","Risso's dolphin",,,"Y","Donator requested that PI request permission to use in study","11/23/2009",2009,11,23,"Marina del Rey",,,,"CALIFORNIA","UNITED STATES OF AMERICA",33.816666,1,"Minute",-118.566666,1,"Minute",1,"North Pacific","U",,12/2/2009 0:00:00,,"TODD CHANDLER:510-414-3138",5/31/2012 16:22:25,"dan.prosperi",6/8/2022 7:21:53
88975,,,"CRC20091111-01",223096,,,,,,,,"BIOPSY (PROJECTILE)",550,"JOHN CALAMBOKIDIS",255,"CASCADIA RESEARCH COLLECTIVE",,,"contact J. Calambokidis",,"ARC",21,"021","C","CETACEA","G gri","Grampus","griseus","Risso's dolphin",,,"Y","Donator requested that PI request permission to use in study","11/11/2009",2009,11,11,"Oxnard",,,,"CALIFORNIA","UNITED STATES OF AMERICA",33.733333,1,"Minute",-119.7,1,"Minute",1,"North Pacific","U",,11/18/2009 0:00:00,,"TODD CHANDLER:510-414-3138",5/31/2012 16:22:26,"dan.prosperi",6/8/2022 7:21:53
92270,,,"RWB34",224893,,,,,,,,"UNKNOWN",,,,,,,,,"WFP",21,"021","C","CETACEA","G gri","Grampus","griseus","Risso's dolphin",,,"N",,"02/13/1976",1976,2,13,"ATLANTIC OCEAN",,,,,,-4.05,1,"Minute",-90.266666,1,"Minute",4,"South Pacific","F","Field determination: external exam only; live animal or carcass was examined but not dissected.",4/6/2010 0:00:00,,"Cartilage from skull.  Source was recorded as ""UNKNOWN-NO DATA""",5/31/2012 16:23:23,"dan.prosperi",6/7/2022 14:59:41
93900,,"HI-LONGLINE","LL3548",225722,,,,,,,,"BYCATCH",530,"JAMIE MARCHETTI",456,"NMFS, PACIFIC ISLANDS REGIONAL OFFICE, OBSERVER PROGRAM",,,"Pacific Islands Regional Office Observer Program",,"SJC",21,"021","C","CETACEA","G gri","Grampus","griseus","Risso's dolphin",,,"Y","No external permission needed, but donator requests notification when used.","04/13/2010",2010,4,13,"NORTH EASTERN PACIFIC OCEAN",,,,,,31.4,1,"Minute",-142.2,1,"Minute",1,"North Pacific","U",,6/14/2010 0:00:00,,"No use restrictions, but would like to be notified of use and purpose - sample use is monitored by the Collections Curator and Manager.",5/31/2012 16:23:52,"Alaina.Harmon",4/26/2023 11:38:40
94413,,,"GCAMPBELL100620.01",225770,,,,,,,,"BIOPSY (PROJECTILE)",394,"Collection Manager - SWFSC ",,,"Greg Campbell",,,,"NMK",21,"021","C","CETACEA","G gri","Grampus","griseus","Risso's dolphin",,,"N",,"06/20/2010",2010,6,20,,,"San Clemente Island",,"CALIFORNIA","UNITED STATES OF AMERICA",32.916666,1,"Minute",-118.433333,1,"Minute",1,"North Pacific","U",,7/14/2010 0:00:00,,"Biopsier: Amanda Debich.    Greg Campbell (SCRIPPS INSTITUTION OF OCEANOGRAPHY, SCRIPPS WHALE ACOUSTIC LAB, 8635 Discovery Way, La Jolla, CA 92093, gscampbell@ucsd.edu) was the original collector and contact. Following his death, use restrictions removed April 2021 per Eric Archer.",5/31/2012 16:24:00,"dan.prosperi",6/24/2022 9:01:16
94471,,,"SMI-1",225828,,,,,,,,"STRANDING",350,"Michelle Berman",10,"Santa Barbara Museum of Natural History",,,"YES, AND NOTIFY OF USE",,"ARC",21,"021","C","CETACEA","G gri","Grampus","griseus","Risso's dolphin",,,"N",,"04/19/2010",2010,4,19,,,"San Miguel Island","Santa Barbara","CALIFORNIA","UNITED STATES OF AMERICA",,,,,,,1,"North Pacific","U","Unknowable (no field data available; molecular determination failed).",7/20/2010 0:00:00,,"98% match in GenBank, KMR.  Sample use not restricted, but would like to be acknowledeged.",5/31/2012 16:24:01,"dan.prosperi",6/23/2022 14:04:57
94472,,,"SMI-2",225829,,,,,,,,"STRANDING",350,"Michelle Berman",10,"Santa Barbara Museum of Natural History",,,"YES, AND NOTIFY OF USE",,"ARC",21,"021","C","CETACEA","G gri","Grampus","griseus","Risso's dolphin",,,"N",,"04/22/2010",2010,4,22,,,"San Miguel Island","Santa Barbara","CALIFORNIA","UNITED STATES OF AMERICA",,,,,,,1,"North Pacific","F","Molecular determination: ZFX/ZFY 5' exonuclease qPCR assay developed at SWFSC.",7/20/2010 0:00:00,,"98% match in Genbank.  Sample use not restricted, but would like to be acknowledeged.",5/31/2012 16:24:01,"dan.prosperi",6/23/2022 14:04:57
94804,,,"CRC20100624-01",225901,,,,,,,,"BIOPSY (PROJECTILE)",550,"JOHN CALAMBOKIDIS",255,"CASCADIA RESEARCH COLLECTIVE",,,"contact J. Calambokidis",,"ARC",21,"021","C","CETACEA","G gri","Grampus","griseus","Risso's dolphin",,,"Y","Donator requested that PI request permission to use in study","06/24/2010",2010,6,24,"SoCAL offshore",,,,"CALIFORNIA","UNITED STATES OF AMERICA",33.083333,1,"Minute",-118.65,1,"Minute",1,"North Pacific","M","Molecular determination: ZFX/ZFY 5' exonuclease qPCR assay developed at SWFSC.",8/18/2010 0:00:00,,"TODD CHANDLER:510-414-3138",5/31/2012 16:24:06,"dan.prosperi",6/8/2022 7:21:53
101142,,,"CRC20100906-PHY-02",226177,,,,,,,,"BIOPSY (PROJECTILE)",550,"JOHN CALAMBOKIDIS",255,"CASCADIA RESEARCH COLLECTIVE",,,"contact J. Calambokidis",,"ARC",21,"021","C","CETACEA","G gri","Grampus","griseus","Risso's dolphin",,,"Y","Donator requested that PI request permission to use in study","09/06/2010",2010,9,6,,,"Channel Islands",,"CALIFORNIA","UNITED STATES OF AMERICA",34.133333,1,"Minute",-120.133333,1,"Minute",1,"North Pacific","F","Molecular determination: ZFX/ZFY 5' exonuclease qPCR assay developed at SWFSC.",10/13/2010 0:00:00,,"photo D20:148.  TODD CHANDLER:510-414-3138",5/31/2012 16:25:52,"dan.prosperi",6/8/2022 7:21:53
101143,,,"CRC20100906-PHY-03",226178,,,,,,,,"BIOPSY (PROJECTILE)",550,"JOHN CALAMBOKIDIS",255,"CASCADIA RESEARCH COLLECTIVE",,,"contact J. Calambokidis",,"ARC",21,"021","C","CETACEA","G gri","Grampus","griseus","Risso's dolphin",,,"Y","Donator requested that PI request permission to use in study","09/06/2010",2010,9,6,,,"Channel Islands",,"CALIFORNIA","UNITED STATES OF AMERICA",34.133333,1,"Minute",-120.133333,1,"Minute",1,"North Pacific","M","Molecular determination: ZFX/ZFY 5' exonuclease qPCR assay developed at SWFSC.",10/13/2010 0:00:00,,"D20:169.  TODD CHANDLER:510-414-3138",5/31/2012 16:25:52,"dan.prosperi",6/8/2022 7:21:53
101144,,,"CRC20100906-PHY-04",226179,,,,,,,,"BIOPSY (PROJECTILE)",550,"JOHN CALAMBOKIDIS",255,"CASCADIA RESEARCH COLLECTIVE",,,"contact J. Calambokidis",,"ARC",21,"021","C","CETACEA","G gri","Grampus","griseus","Risso's dolphin",,,"Y","Donator requested that PI request permission to use in study","09/06/2010",2010,9,6,,,"Channel Islands",,"CALIFORNIA","UNITED STATES OF AMERICA",34.133333,1,"Minute",-120.133333,1,"Minute",1,"North Pacific","F","Molecular determination: ZFX/ZFY 5' exonuclease qPCR assay developed at SWFSC.",10/13/2010 0:00:00,,"TODD CHANDLER:510-414-3138",5/31/2012 16:25:52,"dan.prosperi",6/8/2022 7:21:53
101159,,,"CRC20100828-PHY-01",226194,,,,,,,,"BIOPSY (PROJECTILE)",550,"JOHN CALAMBOKIDIS",255,"CASCADIA RESEARCH COLLECTIVE",,,"contact J. Calambokidis",,"ARC",21,"021","C","CETACEA","G gri","Grampus","griseus","Risso's dolphin",,,"Y","Donator requested that PI request permission to use in study","08/28/2010",2010,8,28,,,"Channel Islands",,"CALIFORNIA","UNITED STATES OF AMERICA",33.45,1,"Minute",-118.333333,1,"Minute",1,"North Pacific","F","Molecular determination: ZFX/ZFY 5' exonuclease qPCR assay developed at SWFSC.",10/13/2010 0:00:00,,"TODD CHANDLER:510-414-3138",5/31/2012 16:25:52,"dan.prosperi",6/22/2022 14:36:27
101160,,,"CRC20100828-PHY-02",226195,,,,,,,,"BIOPSY (PROJECTILE)",550,"JOHN CALAMBOKIDIS",255,"CASCADIA RESEARCH COLLECTIVE",,,"contact J. Calambokidis",,"ARC",21,"021","C","CETACEA","G gri","Grampus","griseus","Risso's dolphin",,,"Y","Donator requested that PI request permission to use in study","08/28/2010",2010,8,28,,,"Channel Islands",,"CALIFORNIA","UNITED STATES OF AMERICA",33.45,1,"Minute",-118.333333,1,"Minute",1,"North Pacific","F","Molecular determination: ZFX/ZFY 5' exonuclease qPCR assay developed at SWFSC.",10/13/2010 0:00:00,,"TODD CHANDLER:510-414-3138",5/31/2012 16:25:52,"dan.prosperi",6/22/2022 14:36:27
101851,,,"C-333",226286,,,,,,,,"STRANDING",383,"Barbie Halaska",4,"The Marine Mammal Center",,,"The Marine Mammal Center, Sausalito, CA",,"ARC",21,"021","C","CETACEA","G gri","Grampus","griseus","Risso's dolphin",,,"N",,"09/15/2010",2010,9,15,,,,"Sonoma","CALIFORNIA","UNITED STATES OF AMERICA",,,,,,,1,"North Pacific","M","Field determination: external exam only; live animal or carcass was examined but not dissected.",10/21/2010 0:00:00,,,5/31/2012 16:26:03,"dan.prosperi",6/14/2022 10:00:08
102563,,,"UNK101026",226766,,,,,,,,"STRANDING",394,"Collection Manager - SWFSC ",1,"SWFSC",,,,,"K_D",21,"021","C","CETACEA","G gri","Grampus","griseus","Risso's dolphin",,,"Y","Donator requested that PI request permission to use in study","10/26/2010",2010,10,26,"AVALON, LITTLE",,"Santa Catalina Island","Los Angeles","CALIFORNIA","UNITED STATES OF AMERICA",33.383333,1,"Minute",-118.466666,1,"Minute",1,"North Pacific","M","Molecular determination: ZFX/ZFY 5' exonuclease qPCR assay developed at SWFSC.",11/12/2010 0:00:00,,"ctyB confirmed 99% match in Genbank. Alaina Harmon, 23 April 2024: No response received from previous contact or organization, Frank Starkey and Catalina Island Conservancy, so permissions reverted to SWFSC.",5/31/2012 16:26:14,"Alaina.Harmon",4/23/2024 16:06:25
108390,,,"MLMLMM2470",229874,,,,,,,,"STRANDING",543,"JIM HARVEY",7,"Moss Landing Marine Laboratories",,,"Moss Landing Marine Laboratories, CA Stranding Network Participants",,"K_D",21,"021","C","CETACEA","G gri","Grampus","griseus","Risso's dolphin",,,"N",,"09/15/2011",2011,9,15,"MOSS LANDING, SALINA RIVER STATE BEACH",,,"Monterey","CALIFORNIA","UNITED STATES OF AMERICA",36.8,1,"Minute",-121.783333,1,"Minute",1,"North Pacific","M","Field determination: external exam only; live animal or carcass was examined but not dissected.",7/18/2012 0:00:00,,"Additional Contact:  P.O. BOX 450, TIFFINI BROOKENS-TJBROOKEN@AOL.COM",7/18/2012 15:41:59,"dan.prosperi",6/21/2022 9:17:40
113015,,"CAGN","BMF0001",230191,,,,,,,,"BYCATCH",385,"Kerri Danil",459,"NMFS, SWR, OBSERVER PROGRAM",,,"NMFS, SOUTHWEST REGION FISHERY OBSERVER PROGRAM and SOUTHWEST FISHERIES SCIENCE CENTER",,"K_D",21,"021","C","CETACEA","G gri","Grampus","griseus","Risso's dolphin",,,"N",,"09/29/2011",2011,9,29,"OFFSHORE",,,,"CALIFORNIA","UNITED STATES OF AMERICA",33.791667,0.1,"MINUTE",-119.506667,0.1,"MINUTE",1,"North Pacific","F","Field determination: external exam only; live animal or carcass was examined but not dissected.",10/16/2012 0:00:00,,,10/16/2012 16:37:37,"dan.prosperi",6/17/2022 15:50:07
113441,,,"NEB0050",230278,,,,,,,,"STRANDING",398,"STRANDING COORDINATOR ",1,"SWFSC",,,"NMFS, Southwest Fisheries Science Center",,"K_D",21,"021","C","CETACEA","G gri","Grampus","griseus","Risso's dolphin",,,"N",,"10/17/2012",2012,10,17,"LA JOLLA, OFFSHORE LA JOLLA COVE",,,"San Diego","CALIFORNIA","UNITED STATES OF AMERICA",32.851989,0.000001,"DEGREE",-117.270193,0.000001,"DEGREE",1,"North Pacific","M","Field determination: gonads were examined; carcass was examined and dissected.",11/21/2012 0:00:00,,,11/21/2012 12:53:35,"dan.prosperi",6/8/2022 7:21:53
113442,,,"KXD0223",230279,,,,,,,,"STRANDING",398,"STRANDING COORDINATOR ",1,"SWFSC",,,"NMFS, Southwest Fisheries Science Center",,"K_D",21,"021","C","CETACEA","G gri","Grampus","griseus","Risso's dolphin",,,"N",,"10/24/2012",2012,10,24,"LA JOLLA, BLACKS BEACH",,,"San Diego","CALIFORNIA","UNITED STATES OF AMERICA",32.875966,0.000001,"DEGREE",-117.25123,0.00001,"DEGREE",1,"North Pacific","M","Field determination: external exam only; live animal or carcass was examined but not dissected.",11/21/2012 0:00:00,,,11/21/2012 12:53:35,"dan.prosperi",6/8/2022 7:21:53
113443,,,"KXD0224",230280,,,,,,,,"STRANDING",398,"STRANDING COORDINATOR ",1,"SWFSC",,,"NMFS, Southwest Fisheries Science Center",,"K_D",21,"021","C","CETACEA","G gri","Grampus","griseus","Risso's dolphin",,,"N",,"11/01/2012",2012,11,1,"LA JOLLA, BLACKS BEACH",,,"San Diego","CALIFORNIA","UNITED STATES OF AMERICA",32.854611,0.000001,"DEGREE",-117.258944,0.000001,"DEGREE",1,"North Pacific","U","Unknowable (no field data available; molecular determination failed).",11/21/2012 0:00:00,,"qPCR sexing failed multiple times KMR",11/21/2012 12:53:35,"dan.prosperi",6/8/2022 7:21:53
113633,,,"GCAMPBELL110724.01",230345,,,,,,,,"BIOPSY (PROJECTILE)",394,"Collection Manager - SWFSC ",,,"Greg Campbell",,,,"NMK",21,"021","C","CETACEA","G gri","Grampus","griseus","Risso's dolphin",,,"N",,"07/24/2011",2011,7,24,"2 km off lee side of San Clemente Island",,"San Clemente Island",,"CALIFORNIA","UNITED STATES OF AMERICA",32.90055,0.001,"MINUTE",-118.4184,0.001,"MINUTE",1,"North Pacific","U",,1/11/2013 0:00:00,,"Greg Campbell (SCRIPPS INSTITUTION OF OCEANOGRAPHY, SCRIPPS WHALE ACOUSTIC LAB, 8635 Discovery Way, La Jolla, CA 92093, gscampbell@ucsd.edu) was the original collector and contact. Following his death, use restrictions removed April 2021 per Eric Archer.",1/11/2013 15:49:08,"dan.prosperi",6/24/2022 9:01:16
113634,,,"GCAMPBELL110724.02",230346,,,,,,,,"BIOPSY (PROJECTILE)",394,"Collection Manager - SWFSC ",,,"Greg Campbell",,,,"NMK",21,"021","C","CETACEA","G gri","Grampus","griseus","Risso's dolphin",,,"N",,"07/24/2011",2011,7,24,"2 km off lee side of San Clemente Island",,"San Clemente Island",,"CALIFORNIA","UNITED STATES OF AMERICA",32.913216,0.001,"MINUTE",-118.40975,0.001,"MINUTE",1,"North Pacific","U",,1/11/2013 0:00:00,,"Greg Campbell (SCRIPPS INSTITUTION OF OCEANOGRAPHY, SCRIPPS WHALE ACOUSTIC LAB, 8635 Discovery Way, La Jolla, CA 92093, gscampbell@ucsd.edu) was the original collector and contact. Following his death, use restrictions removed April 2021 per Eric Archer.",1/11/2013 15:49:08,"dan.prosperi",6/24/2022 9:01:16
114337,,,"CWC-JLH-12-1202D",230742,,,,,,,,"STRANDING",460,"CYNTHIA REYES",14,"California Wildlife Center",,,,,"ARC",21,"021","C","CETACEA","G gri","Grampus","griseus","Risso's dolphin",,,"N",,"12/10/2012",2012,12,10,"Malibu, Broad Beach",,,"Los Angeles","CALIFORNIA","UNITED STATES OF AMERICA",34.031421,0.000001,"DEGREE",-118.846652,0.000001,"DEGREE",1,"North Pacific","F","Field determination: gonads were examined; carcass was examined and dissected.",3/12/2013 0:00:00,,,3/12/2013 11:52:29,"dan.prosperi",6/23/2022 13:23:52
114346,,"HI-LONGLINE","LL4491",230751,,,,,,,,"BYCATCH",530,"JAMIE MARCHETTI",456,"NMFS, PACIFIC ISLANDS REGIONAL OFFICE, OBSERVER PROGRAM",,,"Pacific Islands Regional Office Observer Program",,"SJC",21,"021","C","CETACEA","G gri","Grampus","griseus","Risso's dolphin",,,"Y","No external permission needed, but donator requests notification when used.","01/25/2013",2013,1,25,"NORTH EASTERN PACIFIC OCEAN",,,,,,34.701667,0.1,"MINUTE",-138.419167,0.1,"MINUTE",1,"North Pacific","U",,4/5/2013 0:00:00,,"No use restrictions, but would like to be notified of use and purpose - sample use is monitored by the Collections Curator and Manager.",4/5/2013 15:04:55,"Alaina.Harmon",4/26/2023 11:39:05
117598,,,"SW131056",231946,,,,,,,,"STRANDING",371,"Eric Otjen",192,"Sea World - San Diego",,,,,"K_D",21,"021","C","CETACEA","G gri","Grampus","griseus","Risso's dolphin",,,"Y","Donator requested that PI request permission to use in study","09/15/2013",2013,9,15,"Manhatten Beach",,,"Los Angeles","CALIFORNIA","UNITED STATES OF AMERICA",33.885556,0.000001,"DEGREE",-118.412778,0.000001,"DEGREE",1,"North Pacific","F","Field determination: external exam only; live animal or carcass was examined but not dissected.",11/19/2013 0:00:00,,"Animal transferred from Fort McArthur to Sea World San Diego where it died.",11/19/2013 14:37:32,"Alaina.Harmon",11/20/2023 14:31:22
117772,,,"C-411",231998,,,,,,,,"STRANDING",383,"Barbie Halaska",4,"The Marine Mammal Center",,,"The Marine Mammal Center, Sausalito, CA",,"ARC",21,"021","C","CETACEA","G gri","Grampus","griseus","Risso's dolphin",,,"N",,"10/18/2013",2013,10,18,"SEASIDE",,,"Monterey","CALIFORNIA","UNITED STATES OF AMERICA",,,,,,,1,"North Pacific","F","Field determination: gonads were examined; carcass was examined and dissected.",12/4/2013 0:00:00,,,12/4/2013 15:26:55,"dan.prosperi",6/14/2022 10:00:08
118477,,,"CRC-20130923-PHY-02",232427,,,,,,,,"TAGGING",550,"JOHN CALAMBOKIDIS",255,"CASCADIA RESEARCH COLLECTIVE",,,"contact J. Calambokidis",,"ARC",21,"021","C","CETACEA","G gri","Grampus","griseus","Risso's dolphin",,,"Y","Donator requested that PI request permission to use in study","09/23/2013",2013,9,23,,,"Santa Catalina Island",,"CALIFORNIA","UNITED STATES OF AMERICA",33.303,0.001,"DEGREE",-118.192,0.001,"DEGREE",1,"North Pacific","U",,12/18/2013 0:00:00,,"Small amount of skin found in cups during tag processing.  TODD CHANDLER:510-414-3138",12/18/2013 13:16:49,"dan.prosperi",6/8/2022 7:21:53
123934,,,"GCAMPBELL110109.01",233029,,,,,,,,"BIOPSY (PROJECTILE)",394,"Collection Manager - SWFSC ",,,"Greg Campbell",,,,"NMK",21,"021","C","CETACEA","G gri","Grampus","griseus","Risso's dolphin",,,"N",,"01/09/2011",2011,1,9,"Lee Side, 2 km from shore",,"Santa Catalina Island",,"CALIFORNIA","UNITED STATES OF AMERICA",33.4,1,"Minute",-118.35,1,"Minute",1,"North Pacific","U",,1/14/2011 0:00:00,,"Greg Campbell (SCRIPPS INSTITUTION OF OCEANOGRAPHY, SCRIPPS WHALE ACOUSTIC LAB, 8635 Discovery Way, La Jolla, CA 92093, gscampbell@ucsd.edu) was the original collector and contact. Following his death, use restrictions removed April 2021 per Eric Archer.",5/31/2012 16:27:58,"dan.prosperi",6/24/2022 9:01:16
